,_id,name,sku,country,region,type,alcohol,giftbox,volume,description,chilled,quantity,foc,cartonPrice,movingAvgCost,smartPrice,price,pck,metaTitle,metaKeywords,metaDescription,image,isFeatured,bulkDisable,outOfStockType,availabilityDays,availabilityTime,deliveryType,isLoyalty,loyaltyType,dealerData,isSampleProduct,showInterest,bulkPricing,slug,categories,loyalty,shortDescription,status,mainProduct,newTagDuration,newTagDurationReset,updated_at,created_at,imageFiles,rack,barcode,url,api,prisync.name,prisync.category.name,prisync.brand.name,prisync.product_code,prisync.cost,newTillDate.sec,newTillDate.usec,prisyncId,prisync.id,prisync.category.id,prisync.brand.id,prisync.external_ref,prisync.smart_price,prisync.urls,isProductLabel,prisync.barcode,noImage,loyaltyValueType,loyaltyValuePoint,Age in years,brand
318,5f7edff99ae56e6d7b8b49de,nikka coffey malt 70cl,WJP028,Japan,Hokkaido,Single Malt Whisky,45%,0,700,"While most distilleries use their Coffey stills only to make grain whisky, Nikka use the two Coffey stills at their Miyagikyo distillery to create malt whisky too. The Nikka Coffey Malt Whisky was introduced to their selection of expressions in 2014. Plenty rich and flavoursome, it&#39;s a wonderful addition to Nikka&#39;s fantastic range.</p>
",0,72,0,92.59,92.59,117,92.59,1,Buy Nikka Coffey Malt 70cl Online - Free Delivery in Singapore,"Nikka Coffey Malt 70cl free delivery in singapore, buy Nikka Coffey Malt 70cl online SG, Nikka Coffey Malt 70cl delivery singapore",Order Nikka Coffey Malt 70cl in Singapore from our online Alcohol Delivery shop - Alcohaul. Buy Nikka Coffey Malt 70cl online & get free delivery above $100 anywhere in Singapore.,nikka-coffey-malt-700ml,0,1,2,2,990,0,0,0,"dealerId: 5f7edc0b9ae56e6d7b8b469e, cost: 92.59",0,0,"   from_qty : 2,  to_qty : 5,  smartPrice : 114 ,   from_qty : 6,  to_qty : 10,  smartPrice : 113  ",nikka-coffey-malt-70cl,"5f7edb089ae56e6d7b8b459f, 5f7edb099ae56e6d7b8b45a0",0,Nikka Coffey Malt 70cl,1,,0,0,20/06/21 4:55,08/10/20 9:46,"source: 5f7edff99ae56e6d7b8b49de_0.jpg, label: nikka-coffey-malt-700ml, order: 1, coverimage: 1",D6-4-F,"code: 4904230035725, qty: 1",https://alcohaul.sg/products/nikka-coffey-malt-70cl,https://alcohaul.sg/api/productdetail/?slug=nikka-coffey-malt-70cl,Nikka Coffey Malt 70cl,Whisky,New AH,WJP028,92.59,1602150393,0,,,,,,,,,,,,,,nikka
319,5f7edb0a9ae56e6d7b8b45a3,nikka miyagikyo 12yrs 70cl,WJP040,Japan,Hokkaido,Single Malt Whisky,45%,0,700,"Replacing the previous NAS Miyagikyo single malt as well as the remaining age statement expressions, this single release will represent the distillery going forward as demand for Japanese whisky remains as strong as ever. The new single malt is said to be made with whiskies spanning various ages (hinting at the inclusion of older whiskies than the previous NAS release) with classic delicate, floral character and primarily ex-Sherry casks used for maturation.

 
",0,9999,0,0,798,798,798,0,Buy Nikka Miyagikyo 12yrs 70cl Online - Free Delivery in Singapore,"Nikka Miyagikyo 12yrs 70cl free delivery in singapore, buy Nikka Miyagikyo 12yrs 70cl online SG, Nikka Miyagikyo 12yrs 70cl delivery singapore",Order Nikka Miyagikyo 12yrs 70cl in Singapore from our online Alcohol Delivery shop - Alcohaul. Buy Nikka Miyagikyo 12yrs 70cl online & get free delivery above $100 anywhere in Singapore.,Nikka-Miyagikyo-12yrs-700ml,0,1,2,2,990,0,0,0,"dealerId: 5f7edb099ae56e6d7b8b45a1, cost: 798",0,0,"   from_qty : 2,  to_qty : 5,  smartPrice : 0 ,   from_qty : 6,  to_qty : 10,  smartPrice : 0  ",nikka-miyagikyo-12yrs-70cl,"5f7edb089ae56e6d7b8b459f, 5f7edb099ae56e6d7b8b45a0",0,Nikka Miyagikyo 12yrs 70cl,1,,0,0,03/12/20 1:49,08/10/20 9:25,"source: 5f7edb0a9ae56e6d7b8b45a3_0.jpg, label: Nikka-Miyagikyo-12yrs-700ml, order: 1, coverimage: 1",F2-8-F,,https://alcohaul.sg/products/nikka-miyagikyo-12yrs-70cl,https://alcohaul.sg/api/productdetail/?slug=nikka-miyagikyo-12yrs-70cl,Nikka Miyagikyo 12yrs 70cl,Whisky,New AH,WJP040,798,1602149130,0,,,,,,,,,,,,,12yr,nikka
320,5f7edfe89ae56e6d7b8b49d0,nikka miyagikyo 70cl,WJP012,Japan,Hokkaido,Single Malt Whiskey,45%,Y,700,"Nose: Full-flavoured, rich. Initially, concentrated iris notes hint at the extreme intensity of the nose. It then develops aromas of malted barley, exotic fruit (banana), liquorice and camphor. Notes of burnt wood and ash progressively settle over the aromatic palette. Long after, white flowers and beeswax make an appearance. Palate: Firm, lively. Malted barley is at the heart of the palate, coated in herbaceous, liquorice, spiced (ginger, cinnamon) and chocolate tones. Very elegant, the mid-palate also delivers plenty of energy and as it draws to a close, fresh tobacco leaves and coconut intertwine to create a natural symphony of aromas. Finish: Long, soft. It evokes the scent of wilted roses. Fine tannins balance its tangy character (lemon, grapefruit). It lingers on notes of tobacco, spices (cardamom, ginger), toasted nuts and stewed fruits (apple, damson). The final nose reveals exotic notes (lychee).
",0,9953,0,0,112,112,112,0,Buy Nikka Miyagikyo 70cl Online - Free Delivery in Singapore,"Nikka Miyagikyo 70cl free delivery in singapore, buy Nikka Miyagikyo 70cl online SG, Nikka Miyagikyo 70cl delivery singapore",Order Nikka Miyagikyo 70cl in Singapore from our online Alcohol Delivery shop - Alcohaul. Buy Nikka Miyagikyo 70cl online & get free delivery above $100 anywhere in Singapore.,nikka-miyagikyo,0,1,2,2,990,0,0,0,"dealerId: 5f7edae09ae56e6d7b8b4568, cost: 112",0,0,"   from_qty : 2,  to_qty : 5,  smartPrice : 0 ,   from_qty : 6,  to_qty : 10,  smartPrice : 0  ",nikka-miyagikyo-70cl,"5f7edb089ae56e6d7b8b459f, 5f7edb099ae56e6d7b8b45a0",0,Nikka Miyagikyo 70cl,1,,0,0,11/06/21 7:34,08/10/20 9:46,"source: 5f7edfe89ae56e6d7b8b49d0_0.jpg, label: nikka-miyagikyo, order: 1, coverimage: 1",A5-24-F,"code: 4904230042242, qty: 1",https://alcohaul.sg/products/nikka-miyagikyo-70cl,https://alcohaul.sg/api/productdetail/?slug=nikka-miyagikyo-70cl,Nikka Miyagikyo 70cl,Whisky,New AH,WJP012,112,1602150376,0,,,,,,,,,,,,,,nikka
321,5f7ee0069ae56e6d7b8b49e8,nikka pure malt black 50cl,WJP046,Japan,Hokkaido,Blended Malt Whisky,43%,0,500,"A storming example of what Japanese whisky is truly capable of. A previous batch was awarded a massive 95 points by Jim Murray in his Whisky Bible.
",0,9980,0,71.39,71.39,88,88,1,Buy Nikka Pure Malt Black 50cl Online - Free Delivery in Singapore,"Nikka Pure Malt Black 50cl free delivery in singapore, buy Nikka Pure Malt Black 50cl online SG, Nikka Pure Malt Black 50cl delivery singapore",Order Nikka Pure Malt Black 50cl in Singapore from our online Alcohol Delivery shop - Alcohaul. Buy Nikka Pure Malt Black 50cl online & get free delivery above $100 anywhere in Singapore.,nikka-pure-malt-black-700ml,0,1,2,2,990,0,0,0,"dealerId: 5f7edc0b9ae56e6d7b8b469e, cost: 71.39",0,0,"   from_qty : 2,  to_qty : 5,  smartPrice : 0 ,   from_qty : 6,  to_qty : 10,  smartPrice : 0  ",nikka-pure-malt-black-50cl,"5f7edb089ae56e6d7b8b459f, 5f7edb099ae56e6d7b8b45a0",0,Nikka Pure Malt Black 50cl,1,,0,0,21/06/21 18:10,08/10/20 9:46,"source: 5f7ee0069ae56e6d7b8b49e8_0.jpg, label: nikka-pure-malt-black-700ml, order: 1, coverimage: 1",D6-5-F,"code: 4904230101451, qty: 1",https://alcohaul.sg/products/nikka-pure-malt-black-50cl,https://alcohaul.sg/api/productdetail/?slug=nikka-pure-malt-black-50cl,Nikka Pure Malt Black 50cl,Whisky,New AH,WJP046,71.39,1602150406,0,,,,,,,,,,,,,,nikka
322,5f7ee0089ae56e6d7b8b49e9,nikka pure malt red 50cl,WJP047,Japan,Hokkaido,Blended Malt Whisky,43%,0,500,"Blended with Japanese malt from Nikka's Yoichi and Miyagikyo distilleries, this is clean, fruity and very easy to drink.
",0,9993,0,71.39,71.39,88,88,1,Buy Nikka Pure Malt Red 50cl Online - Free Delivery in Singapore,"Nikka Pure Malt Red 50cl free delivery in singapore, buy Nikka Pure Malt Red 50cl online SG, Nikka Pure Malt Red 50cl delivery singapore",Order Nikka Pure Malt Red 50cl in Singapore from our online Alcohol Delivery shop - Alcohaul. Buy Nikka Pure Malt Red 50cl online & get free delivery above $100 anywhere in Singapore.,nikka-pure-malt-red-700ml,0,1,2,2,990,0,0,0,"dealerId: 5f7edc0b9ae56e6d7b8b469e, cost: 71.39",0,0,"   from_qty : 2,  to_qty : 5,  smartPrice : 0 ,   from_qty : 6,  to_qty : 10,  smartPrice : 0  ",nikka-pure-malt-red-50cl,"5f7edb089ae56e6d7b8b459f, 5f7edb099ae56e6d7b8b45a0",0,Nikka Pure Malt Red 50cl,1,,0,0,21/06/21 18:10,08/10/20 9:46,"source: 5f7ee0089ae56e6d7b8b49e9_0.jpg, label: nikka-pure-malt-red-700ml, order: 1, coverimage: 1",D6-6-F,"code: 4904230101468, qty: 1",https://alcohaul.sg/products/nikka-pure-malt-red-50cl,https://alcohaul.sg/api/productdetail/?slug=nikka-pure-malt-red-50cl,Nikka Pure Malt Red 50cl,Whisky,New AH,WJP047,71.39,1602150408,0,,,,,,,,,,,,,,nikka
323,5fcf08cb5f2f3d6f318b4567,nikka super nikka 70cl,WSB062,Japan,Japan,Single Malt Whiskey,43%,Y,700,"span style=""color: rgb(0, 0, 0); font-family: Arial; font-size: 13.3333px;"">A new direction for the classic &#39;Super Nikka&#39; blended Japanese whisky label, with a limited edition release. Revival brings together Sherry matured Nikka and Yoichi stock with a special bottling for Europe.</span></p>
",0,3,0,129.6,66.88,118.8,66.88,1,Buy Nikka Super Nikka 70cl Online - Free Delivery in Singapore,"Nikka Super Nikka 70cl free delivery in singapore, buy Nikka Super Nikka 70cl online SG, Nikka Super Nikka 70cl delivery singapore",Order Nikka Super Nikka 70cl in Singapore from our online Alcohol Delivery shop - Alcohaul. Buy Nikka Super Nikka 70cl online & get free delivery above $100 anywhere in Singapore.,suntory-yamazaki-distillers-reserve,0,1,1,2,990,0,0,0,"dealerId: 5f7edae09ae56e6d7b8b4568, cost: 66.88",0,0,"   from_qty : 2,  to_qty : 5,  smartPrice : 116 ,   from_qty : 6,  to_qty : 10,  smartPrice : 115  ",nikka-super-nikka-70cl,"5f7edb089ae56e6d7b8b459f, 5f7edb099ae56e6d7b8b45a0",100,"Japan, Japanese Whisky, 43.0% ABV",1,,0,0,24/02/21 5:26,08/12/20 5:02,"source: 5fcf08cb5f2f3d6f318b4567_0.jpg, label: Nikka Super Nikka 70cl, order: 1, coverimage: 1",A5-25-F,"code: 3700597302347, qty: 1",https://alcohaul.sg/products/nikka-super-nikka-70cl,https://alcohaul.sg/api/productdetail/?slug=nikka-super-nikka-70cl,Nikka Super Nikka 70cl,0,0,0,129.6,1607403723,0,,,,,,,,,,,,,,nikka
324,5f7edffa9ae56e6d7b8b49df,nikka taketsuru 12yrs 70cl,WJP030,Japan,Hokkaido,Single Malt Whiskey,40%,Y,700,"The 12 year old variant of Nikka's incredible range of blended malts, named after the company's founder, Masataka Taketsuru. Very good indeed.

Nose: Floral and balanced, with notes of plum jam, cut herbs, rhubarb pie, vanilla ice cream and cold coffee.
Palate: Sweet and oily, apple cider, cinnamon sticks, buttery toffee, almond, salty butter, custard.
Finish: Good length, creamy, notes of digestive biscuit and rhubarb crumble.
",0,9999,0,0,549,549,549,0,Buy Nikka Taketsuru 12yrs 70cl Online - Free Delivery in Singapore,"Nikka Taketsuru 12yrs 70cl free delivery in singapore, buy Nikka Taketsuru 12yrs 70cl online SG, Nikka Taketsuru 12yrs 70cl delivery singapore",Order Nikka Taketsuru 12yrs 70cl in Singapore from our online Alcohol Delivery shop - Alcohaul. Buy Nikka Taketsuru 12yrs 70cl online & get free delivery above $100 anywhere in Singapore.,nikka-taketsuru-12-years-700ml,0,1,2,2,990,0,0,0,"dealerId: 5f7edb099ae56e6d7b8b45a1, cost: 549",0,0,"   from_qty : 2,  to_qty : 5,  smartPrice : 0 ,   from_qty : 6,  to_qty : 10,  smartPrice : 0  ",nikka-taketsuru-12yrs-70cl,"5f7edb089ae56e6d7b8b459f, 5f7edb099ae56e6d7b8b45a0",0,Nikka Taketsuru 12yrs 70cl,1,,0,0,10/12/20 6:15,08/10/20 9:46,"source: 5f7edffa9ae56e6d7b8b49df_0.jpg, label: nikka-taketsuru-12-years-700ml, order: 1, coverimage: 1",F2-9-F,,https://alcohaul.sg/products/nikka-taketsuru-12yrs-70cl,https://alcohaul.sg/api/productdetail/?slug=nikka-taketsuru-12yrs-70cl,Nikka Taketsuru 12yrs 70cl,Whisky,New AH,WJP030,549,1602150394,0,,,,,,,,,,,,,12yr,nikka
325,5f7edfeb9ae56e6d7b8b49d2,nikka taketsuru 17 years 70cl,WJP014,Japan,Hokkaido,Single Malt Whiskey,43%,Y,700,"Nose: Fresh and fruity with fruit salad, berries, sultanas and some other dried fruit, vanilla, fragrant wood and honey. Palate: Spicy and rounded with vanilla, blood orange and a little chocolate. Finish: Medium-length, slightly bittersweet, oak, fruit and cocoa.

*NO BOX*
",0,10000,0,0,699,699,699,0,Buy Nikka Taketsuru 17 Years 70cl Online - Free Delivery in Singapore,"Nikka Taketsuru 17 Years 70cl free delivery in singapore, buy Nikka Taketsuru 17 Years 70cl online SG, Nikka Taketsuru 17 Years 70cl delivery singapore",Order Nikka Taketsuru 17 Years 70cl in Singapore from our online Alcohol Delivery shop - Alcohaul. Buy Nikka Taketsuru 17 Years 70cl online & get free delivery above $100 anywhere in Singapore.,nikka-taketsuru-17-years-700ml,0,1,2,2,990,0,0,0,"dealerId: 5f7edae09ae56e6d7b8b4568, cost: 699",0,0,"   from_qty : 2,  to_qty : 5,  smartPrice : 0 ,   from_qty : 6,  to_qty : 10,  smartPrice : 0  ",nikka-taketsuru-17-years-70cl,"5f7edb089ae56e6d7b8b459f, 5f7edb099ae56e6d7b8b45a0",0,Nikka Taketsuru 17 Years 70cl,1,,0,0,10/10/20 9:00,08/10/20 9:46,"source: 5f7edfeb9ae56e6d7b8b49d2_0.jpg, label: nikka-taketsuru-17-years-700ml, order: 1, coverimage: 1",F2-10-F,,https://alcohaul.sg/products/nikka-taketsuru-17-years-70cl,https://alcohaul.sg/api/productdetail/?slug=nikka-taketsuru-17-years-70cl,Nikka Taketsuru 17 Years 70cl,Whisky,New AH,WJP014,699,1602150379,0,,,,,,,,,,,,,17 year,nikka
326,5f7edfec9ae56e6d7b8b49d3,nikka taketsuru 21 years 70cl,WJP015,Japan,Hokkaido,Single Malt Whiskey,43%,Y,700,"Taketsuru 21 was crowned World&#39;s Best Blended Malt Whisky at the 2010 World Whiskies Awards. It really is a fabulous whisky, and for those of you who enjoyed the brilliant 17 year old this offers just a bit more richness, a little hint more chocolate and coffee. Nose: Plenty of oak influence with notes of prunes and soy sauce. Cocoa, espresso beans, almost a touch of anise. Palate: Spices, black pepper, loads of tangy sherry, hints of turmeric and other spices. Then ground ginger, mixed peels, hints of marmalade. Finish: Long, good oaky grip with a perfect balance of spice. *NO BOX*</p>
",0,9999,0,0,949,995,949,0,Buy Nikka Taketsuru 21 Years 70cl Online - Free Delivery in Singapore,"Nikka Taketsuru 21 Years 70cl free delivery in singapore, buy Nikka Taketsuru 21 Years 70cl online SG, Nikka Taketsuru 21 Years 70cl delivery singapore",Order Nikka Taketsuru 21 Years 70cl in Singapore from our online Alcohol Delivery shop - Alcohaul. Buy Nikka Taketsuru 21 Years 70cl online & get free delivery above $100 anywhere in Singapore.,nikka-taketsuru-21-years-700ml,0,1,2,2,990,0,0,0,"dealerId: 5f7edae09ae56e6d7b8b4568, cost: 949",0,0,"   from_qty : 2,  to_qty : 5,  smartPrice : 992 ,   from_qty : 6,  to_qty : 10,  smartPrice : 991  ",nikka-taketsuru-21-years-70cl,"5f7edb089ae56e6d7b8b459f, 5f7edb099ae56e6d7b8b45a0",0,Nikka Taketsuru 21 Years 70cl,1,,0,0,01/02/21 4:17,08/10/20 9:46,"source: 5f7edfec9ae56e6d7b8b49d3_0.jpg, label: nikka-taketsuru-21-years-700ml, order: 1, coverimage: 1",F2-11-F,,https://alcohaul.sg/products/nikka-taketsuru-21-years-70cl,https://alcohaul.sg/api/productdetail/?slug=nikka-taketsuru-21-years-70cl,Nikka Taketsuru 21 Years 70cl,Whisky,New AH,WJP015,949,1602150380,0,,,,,,,,,,,,,21 year,nikka
327,5f7edfef9ae56e6d7b8b49d6,nikka taketsuru pure malt 70cl,WJP019,Japan,Hokkaido,Blended Malt Whiskey,43%,Y,700,"A blend of the two Nikka single malts, Taketsuru combines the strong character of Yoichi with the elegance and precision of Miyagikyo. Both masculine and feminine, traditional and innovative, this outstanding pure malt whisky is a worthy tribute to Masataka Taketsuru, the father of Japanese whisky and founder of Nikka. It features plenty of whisky from the Miyagikyo distillery, as well as percentage of malt matured in Sherry casks to give it a rich, spiced nose. Taketsuru's no-age-statement blended malt contains a high percentage of malt from Miyagikyo, with the remainder coming from Yoichi. Aged on average for around 10 years in a variety of different cask types, including some sherry wood for extra richness.
",0,9770,0,79.02,79.02,89,89,1,Buy Nikka Taketsuru Pure Malt 70cl Online - Free Delivery in Singapore,"Nikka Taketsuru Pure Malt 70cl free delivery in singapore, buy Nikka Taketsuru Pure Malt 70cl online SG, Nikka Taketsuru Pure Malt 70cl delivery singapore",Order Nikka Taketsuru Pure Malt 70cl in Singapore from our online Alcohol Delivery shop - Alcohaul. Buy Nikka Taketsuru Pure Malt 70cl online & get free delivery above $100 anywhere in Singapore.,nikka-taketsuru-pure-malt-700ml,0,1,2,2,990,0,0,0,"dealerId: 5f7edc0b9ae56e6d7b8b469e, cost: 79.02",0,0,"   from_qty : 2,  to_qty : 5,  smartPrice : 0 ,   from_qty : 6,  to_qty : 10,  smartPrice : 0  ",nikka-taketsuru-pure-malt-70cl,"5f7edb089ae56e6d7b8b459f, 5f7edb099ae56e6d7b8b45a0",0,Nikka Taketsuru Pure Malt 70cl,1,,0,0,08/07/21 3:45,08/10/20 9:46,"source: 5f7edfef9ae56e6d7b8b49d6_0.jpg, label: nikka-taketsuru-pure-malt-700ml, order: 1, coverimage: 1",D6-7-F,"code: 4904230034971, qty: 1",https://alcohaul.sg/products/nikka-taketsuru-pure-malt-70cl,https://alcohaul.sg/api/productdetail/?slug=nikka-taketsuru-pure-malt-70cl,Nikka Taketsuru Pure Malt 70cl,Whisky,New AH,WJP019,79.02,1602150383,0,,,,,,,,,,,,,,nikka
328,5f7edfe19ae56e6d7b8b49c9,nikka whisky from the barrel 50cl,WJP006,Japan,Hokkaido,Blended Whiskey,51%,Y,500,"Awards: Bronze - Daily Dram - 2013, Malt Maniacs Awards Nose: Medium-body with good balance. There are notes of cut flowers and fresh fruits, spice and a little oak. Palate: Full-bodied and punchy. There is plenty of winter spice and toffee, a little caramel and vanilla and a good mouthful of fruit. Finish: Long, warming and fruity with a little oaken spice.
",0,9527,0,55.18,55.18,68.2,68.2,1,Buy Nikka Whisky From The Barrel 50cl Online - Free Delivery in Singapore,"Nikka Whisky From The Barrel 50cl free delivery in singapore, buy Nikka Whisky From The Barrel 50cl online SG, Nikka Whisky From The Barrel 50cl delivery singapore",Order Nikka Whisky From The Barrel 50cl in Singapore from our online Alcohol Delivery shop - Alcohaul. Buy Nikka Whisky From The Barrel 50cl online & get free delivery above $100 anywhere in Singapore.,nikka-whisky-from-the-barrel,0,1,2,2,990,0,0,0,"dealerId: 5f7edae09ae56e6d7b8b4568, cost: 55.18",0,0,"   from_qty : 2,  to_qty : 5,  smartPrice : 0 ,   from_qty : 6,  to_qty : 10,  smartPrice : 0  ",nikka-whisky-from-the-barrel-50cl,"5f7edb089ae56e6d7b8b459f, 5f7edb099ae56e6d7b8b45a0",0,Nikka Whisky From The Barrel 50cl,1,,0,0,06/07/21 2:41,08/10/20 9:46,"source: 5f7edfe19ae56e6d7b8b49c9_0.jpg, label: nikka-whisky-from-the-barrel, order: 1, coverimage: 1","B1-1-F,B1-2-F","code: 3700597302378, qty: 1",https://alcohaul.sg/products/nikka-whisky-from-the-barrel-50cl,https://alcohaul.sg/api/productdetail/?slug=nikka-whisky-from-the-barrel-50cl,Nikka Whisky From The Barrel 50cl,Whisky,New AH,WJP006,55.18,1602150369,0,,,,,,,,,,,,,,nikka
329,5f7edff89ae56e6d7b8b49dd,nikka yoichi 15yrs 75cl,WJP027,Japan,Hokkaido,Single Malt Whiskey,45%,Y,750,"A delicious single malt from the Yoichi distillery, founded by Masataka Taketsuru in 1934. Taketsuru deemed the terroir to be perfect for whisky production, as this 15 year old will testify. The nose is gentle and creamy with light fruits and a little nutty development. The palate is quite sweet with notes of subdued peat, winter spice and a nutty note. The finish is long and beautifully bittersweet.</p>
",0,0,0,0,650,650,650,0,Buy Nikka Yoichi 15yrs 75cl Online - Free Delivery in Singapore,"Nikka Yoichi 15yrs 75cl free delivery in singapore, buy Nikka Yoichi 15yrs 75cl online SG, Nikka Yoichi 15yrs 75cl delivery singapore",Order Nikka Yoichi 15yrs 75cl in Singapore from our online Alcohol Delivery shop - Alcohaul. Buy Nikka Yoichi 15yrs 75cl online & get free delivery above $100 anywhere in Singapore.,nikka-yoichi-15-years-750ml,0,1,2,2,990,0,0,0,"dealerId: 5f7edb099ae56e6d7b8b45a1, cost: 650",0,0,"   from_qty : 2,  to_qty : 5,  smartPrice : 650 ,   from_qty : 6,  to_qty : 10,  smartPrice : 650  ",nikka-yoichi-15yrs-75cl,"5f7edb089ae56e6d7b8b459f, 5f7edb099ae56e6d7b8b45a0",0,Nikka Yoichi 15yrs 75cl,1,,0,0,05/02/21 3:53,08/10/20 9:46,"source: 5f7edff89ae56e6d7b8b49dd_0.png, label: nikka-yoichi-15-years-750ml, order: 1, coverimage: 1",,,https://alcohaul.sg/products/nikka-yoichi-15yrs-75cl,https://alcohaul.sg/api/productdetail/?slug=nikka-yoichi-15yrs-75cl,Nikka Yoichi 15yrs 75cl,Whisky,New AH,WJP027,650,1602150392,0,,,,,,,,,,,,,15yr,nikka
330,5f7edfe99ae56e6d7b8b49d1,nikka yoichi 70cl,WJP013,Japan,Hokkaido,Single Malt Whiskey,45%,Y,700,"Nose: Full-bodied, smooth. A mellow peat softly coats the aromatic palette at first, growing more powerful with time, as smoke, soot and salty notes transcend the initial nose. The aromas then evolve towards candied citrus fruit (lemon, orange), black liquorice and spices (nutmeg, ginger), and opens up with roots and dried twig aromas. Heady and floral (carnation, iris), it grows increasingly complex. Palate: Firm, powerful. A well-balanced attack gives equal footing to aromas of peat, smoke, spices, fresh fruit (melon, kiwi) and nuts (almond, walnut), which it delivers in spades. The mid-palate starts off with chocolate notes, but the peat soon takes the lead once again. Finish: Long, silky. Extremely mature, it overflows with ripe fruit (pear, Mirabelle plum, apple). The peat starts taking on an herbaceous and malty character, while the salty flavours gives the finish plenty of depth and coastal freshness. The final nose offers menthol, spicy (coriander, dill) and earthy (leather, chestnuts) notes.
",0,9922,0,0,110,110,110,0,Buy Nikka Yoichi 70cl Online - Free Delivery in Singapore,"Nikka Yoichi 70cl free delivery in singapore, buy Nikka Yoichi 70cl online SG, Nikka Yoichi 70cl delivery singapore",Order Nikka Yoichi 70cl in Singapore from our online Alcohol Delivery shop - Alcohaul. Buy Nikka Yoichi 70cl online & get free delivery above $100 anywhere in Singapore.,nikka-yoichi,0,1,2,2,990,0,0,0,"dealerId: 5f7edae09ae56e6d7b8b4568, cost: 110",0,0,"   from_qty : 2,  to_qty : 5,  smartPrice : 0 ,   from_qty : 6,  to_qty : 10,  smartPrice : 0  ",nikka-yoichi-70cl,"5f7edb089ae56e6d7b8b459f, 5f7edb099ae56e6d7b8b45a0",0,Nikka Yoichi 70cl,1,,0,0,31/05/21 18:03,08/10/20 9:46,"source: 5f7edfe99ae56e6d7b8b49d1_0.jpg, label: nikka-yoichi, order: 1, coverimage: 1",B1-3-F,"code: 4904230042204, qty: 1",https://alcohaul.sg/products/nikka-yoichi-70cl,https://alcohaul.sg/api/productdetail/?slug=nikka-yoichi-70cl,Nikka Yoichi 70cl,Whisky,New AH,WJP013,110,1602150377,0,,,,,,,,,,,,,,nikka
331,5f7ee0509ae56e6d7b8b4a21,nomad outland whisky 70cl,WSB059,Spain,Speyside,Blended Whisky,41.30%,0,700,"Nomad Outland Whisky is a collaborative blended whisky from renowned master distiller Richard Paterson and expert Sherry producers Gonzalez Byass. It is made with a selection of over 30 malt and grain whiskies aged between 5 and 8 years old, which are blended together and matured in Sherry butts in Scotland for three years. Following that, the whisky is shipped off to Jerez, where it is finished in Pedro Ximnez casks for a year before it is bottled. Richard Paterson and Gonzalez Byass&#39; master distiller Antonio Flores experimented with different Sherry casks, including Oloroso and Fino, but ultimately decided on the Pedro Ximnez casks for this enticing expression.</p>
",0,0,0,66,66,81,66,1,Buy Nomad Outland Whisky 70cl Online - Free Delivery in Singapore,"Nomad Outland Whisky 70cl free delivery in singapore, buy Nomad Outland Whisky 70cl online SG, Nomad Outland Whisky 70cl delivery singapore",Order Nomad Outland Whisky 70cl in Singapore from our online Alcohol Delivery shop - Alcohaul. Buy Nomad Outland Whisky 70cl online & get free delivery above $100 anywhere in Singapore.,nomad-outland-whisky-700ml,0,1,2,2,990,0,0,0,"dealerId: 5f7edc259ae56e6d7b8b46b4, cost: 66",0,0,"   from_qty : 2,  to_qty : 5,  smartPrice : 79 ,   from_qty : 6,  to_qty : 10,  smartPrice : 79  ",nomad-outland-whisky-70cl,"5f7edb089ae56e6d7b8b459f, 5f7edb0e9ae56e6d7b8b45a6",0,Nomad Outland Whisky 70cl,1,,0,0,20/05/21 3:11,08/10/20 9:48,"source: 5f7ee0509ae56e6d7b8b4a21_0.jpg, label: nomad-outland-whisky-700ml, order: 1, coverimage: 1",A3-2-F,"code: 8410023031912, qty: 1",https://alcohaul.sg/products/nomad-outland-whisky-70cl,https://alcohaul.sg/api/productdetail/?slug=nomad-outland-whisky-70cl,Nomad Outland Whisky 70cl,Whisky,New AH,WSB059,66,1602150480,0,,,,,,,,,,,,,,nomad outland
