,_id,name,sku,country,region,type,alcohol,giftbox,volume,description,chilled,quantity,foc,cartonPrice,movingAvgCost,smartPrice,price,pck,metaTitle,metaKeywords,metaDescription,image,isFeatured,bulkDisable,outOfStockType,availabilityDays,availabilityTime,deliveryType,isLoyalty,loyaltyType,dealerData,isSampleProduct,showInterest,bulkPricing,slug,categories,loyalty,shortDescription,status,mainProduct,newTagDuration,newTagDurationReset,updated_at,created_at,imageFiles,rack,barcode,url,api,prisync.name,prisync.category.name,prisync.brand.name,prisync.product_code,prisync.cost,newTillDate.sec,newTillDate.usec,prisyncId,prisync.id,prisync.category.id,prisync.brand.id,prisync.external_ref,prisync.smart_price,prisync.urls,isProductLabel,prisync.barcode,noImage,loyaltyValueType,loyaltyValuePoint,Age in years,brand
231,5f7ee04f9ae56e6d7b8b4a20,johnnie walker 18yrs ultimate 70cl,WSB058,Scotland,Speyside,Blended Whisky,40%,Y,700,"Formerly known as Platinum Label, this is a rich and refined blend of whiskies matured for at least 18 years that slips perfectly into the range just behind the iconic Blue Label.
",0,9995,0,440,73.33,155,155,6,Buy Johnnie Walker 18yrs Ultimate 70cl Online - Free Delivery in Singapore,"Johnnie Walker 18yrs Ultimate 70cl free delivery in singapore, buy Johnnie Walker 18yrs Ultimate 70cl online SG, Johnnie Walker 18yrs Ultimate 70cl delivery singapore",Order Johnnie Walker 18yrs Ultimate 70cl in Singapore from our online Alcohol Delivery shop - Alcohaul. Buy Johnnie Walker 18yrs Ultimate 70cl online & get free delivery above $100 anywhere in Singapore.,johnnie-walker-18-years-ultimate-700ml,0,1,2,2,990,0,0,0,"dealerId: 5f7edb1b9ae56e6d7b8b45b4, cost: 73.33",0,0,"   from_qty : 2,  to_qty : 5,  smartPrice : 0 ,   from_qty : 6,  to_qty : 10,  smartPrice : 0  ",johnnie-walker-18yrs-ultimate-70cl,"5f7edb089ae56e6d7b8b459f, 5f7edb0e9ae56e6d7b8b45a6",0,Johnnie Walker 18yrs Ultimate 70cl,1,,0,0,16/03/21 16:12,08/10/20 9:47,"source: 5f7ee04f9ae56e6d7b8b4a20_0.jpg, label: johnnie-walker-18-years-ultimate-700ml, order: 1, coverimage: 1",E2-5-F,"code: 5000267165806, qty: 1",https://alcohaul.sg/products/johnnie-walker-18yrs-ultimate-70cl,https://alcohaul.sg/api/productdetail/?slug=johnnie-walker-18yrs-ultimate-70cl,Johnnie Walker 18yrs Ultimate 70cl,Whisky,New AH,WSB058,73.33,1602150479,0,,,,,,,,,,,,,18yr,johnnie walker
232,5f7edbfe9ae56e6d7b8b4690,johnnie walker black label 20cl,WSB012ML200,Scotland,Speyside,Blended Whisky,40%,0,200,"Rich, fruity and spicy flavours balanced against the smooth, creamy toffee notes, with a smoky finish. Johnnie Walker Black Label Includes more than 30 malt and grain whiskies from all over scotland.
",0,9990,0,0,19.26,19.26,19.26,0,Buy Johnnie Walker Black Label 20cl Online - Free Delivery in Singapore,"Johnnie Walker Black Label 20cl free delivery in singapore, buy Johnnie Walker Black Label 20cl online SG, Johnnie Walker Black Label 20cl delivery singapore",Order Johnnie Walker Black Label 20cl in Singapore from our online Alcohol Delivery shop - Alcohaul. Buy Johnnie Walker Black Label 20cl online & get free delivery above $100 anywhere in Singapore.,Johnnie-Walker-Black-Label-200ml,0,1,2,2,990,0,0,0,"dealerId: 5f846d425f2f3d44368b4568, cost: 19.26",0,0,"   from_qty : 2,  to_qty : 5,  smartPrice : 0 ,   from_qty : 6,  to_qty : 10,  smartPrice : 0  ",johnnie-walker-black-label-20cl,"5f7edb089ae56e6d7b8b459f, 5f7edb0e9ae56e6d7b8b45a6",0,Johnnie Walker Black Label 20cl,1,,0,0,30/12/20 12:23,08/10/20 9:29,"source: 5f7edbfe9ae56e6d7b8b4690_0.jpg, label: Johnnie-Walker-Black-Label-200ml, order: 1, coverimage: 1",D2-22-F,"code: 5000267025209, qty: 1",https://alcohaul.sg/products/johnnie-walker-black-label-20cl,https://alcohaul.sg/api/productdetail/?slug=johnnie-walker-black-label-20cl,Johnnie Walker Black Label 20cl,Whisky,New AH,WSB012ML200,19.26,1602149374,0,,,,,,,,,,,,,,johnnie walker
233,5f7edc019ae56e6d7b8b4693,johnnie walker black label 37.5cl,WSB012ML375,Scotland,Speyside,Blended Whisky,40%,0,50,"Rich, fruity and spicy flavours balanced against the smooth, creamy toffee notes, with a smoky finish. Johnnie Walker Black Label Includes more than 30 malt and grain whiskies from all over scotland.</p>
",0,1000,0,0,10,31.03,10,0,Buy Johnnie Walker Black Label 37.5cl Online - Free Delivery in Singapore,"Johnnie Walker Black Label 37.5cl free delivery in singapore, buy Johnnie Walker Black Label 37.5cl online SG, Johnnie Walker Black Label 37.5cl delivery singapore",Order Johnnie Walker Black Label 37.5cl in Singapore from our online Alcohol Delivery shop - Alcohaul. Buy Johnnie Walker Black Label 37.5cl online & get free delivery above $100 anywhere in Singapore.,Johnnie-Walker-Black-Label-375ml,0,1,2,2,990,0,0,0,"dealerId: 5f846d425f2f3d44368b4568, cost: 31.03",0,0,"   from_qty : 2,  to_qty : 5,  smartPrice : 28 ,   from_qty : 6,  to_qty : 10,  smartPrice : 27  ",johnnie-walker-black-label-375cl,"5f7edb089ae56e6d7b8b459f, 5f7edb0e9ae56e6d7b8b45a6",0,Johnnie Walker Black Label 37.5cl,1,,0,0,22/05/21 12:05,08/10/20 9:29,"source: 5f7edc019ae56e6d7b8b4693_0.jpg, label: Johnnie-Walker-Black-Label-375ml, order: 1, coverimage: 1",D2-22-B,"code: 5000267024608, qty: 1",https://alcohaul.sg/products/johnnie-walker-black-label-375cl,https://alcohaul.sg/api/productdetail/?slug=johnnie-walker-black-label-375cl,Johnnie Walker Black Label 37.5cl,WHISKY,New AH,WSB012ML375,10,1602149377,0,8636933,8636933,355639,548458,,undefined,[],,,,,,,johnnie walker
234,5f7edb109ae56e6d7b8b45a9,johnnie walker black label 4.5l,WSB045,Scotland,Speyside,Blended Whisky,40%,0,5000,"Rich, fruity and spicy flavours balanced against the smooth, creamy toffee notes, with a smoky finish. Johnnie Walker Black Label Includes more than 30 malt and grain whiskies from all over scotland. 4.5 Litres.
",0,9999,0,0,438.9,438.9,438.9,0,Buy Johnnie Walker Black Label 4.5L Online - Free Delivery in Singapore,"Johnnie Walker Black Label 4.5L free delivery in singapore, buy Johnnie Walker Black Label 4.5L online SG, Johnnie Walker Black Label 4.5L delivery singapore",Order Johnnie Walker Black Label 4.5L in Singapore from our online Alcohol Delivery shop - Alcohaul. Buy Johnnie Walker Black Label 4.5L online & get free delivery above $100 anywhere in Singapore.,johnnie-walker-black-label,0,1,2,2,990,0,0,0,"dealerId: 5f846d425f2f3d44368b4568, cost: 438.9",0,0,"   from_qty : 2,  to_qty : 5,  smartPrice : 0 ,   from_qty : 6,  to_qty : 10,  smartPrice : 0  ",johnnie-walker-black-label-45l,"5f7edb089ae56e6d7b8b459f, 5f7edb0e9ae56e6d7b8b45a6",0,Johnnie Walker Black Label 4.5L,1,,0,0,04/12/20 6:14,08/10/20 9:25,"source: 5f7edb109ae56e6d7b8b45a9_0.jpg, label: johnnie-walker-black-label, order: 1, coverimage: 1",,,https://alcohaul.sg/products/johnnie-walker-black-label-45l,https://alcohaul.sg/api/productdetail/?slug=johnnie-walker-black-label-45l,Johnnie Walker Black Label 4.5L,Whisky,New AH,WSB045,438.9,1602149136,0,,,,,,,,,,,,,,johnnie walker
235,5f7ee01e9ae56e6d7b8b49fb,johnnie walker black label 70cl,WSB012,Scotland,Speyside,Blended Whisky,40%,0,700,"Rich, fruity and spicy flavours balanced against the smooth, creamy toffee notes, with a smoky finish. Johnnie Walker Black Label Includes more than 30 malt and grain whiskies from all over scotland.</p>
",0,351,0,43.3,43.3,54.39,43.3,1,Buy Johnnie Walker Black Label 70cl Online - Free Delivery in Singapore,"Johnnie Walker Black Label 70cl free delivery in singapore, buy Johnnie Walker Black Label 70cl online SG, Johnnie Walker Black Label 70cl delivery singapore",Order Johnnie Walker Black Label 70cl in Singapore from our online Alcohol Delivery shop - Alcohaul. Buy Johnnie Walker Black Label 70cl online & get free delivery above $100 anywhere in Singapore.,johnnie-walker-black-label,0,1,2,2,990,0,0,0,"dealerId: 5f7edafd9ae56e6d7b8b458f, cost: 43.3",0,0,"   from_qty : 2,  to_qty : 5,  smartPrice : 53 ,   from_qty : 6,  to_qty : 10,  smartPrice : 52  ",johnnie-walker-black-label-70cl,"5f7edb089ae56e6d7b8b459f, 5f7edb0e9ae56e6d7b8b45a6",0,Johnnie Walker Black Label 70cl,1,,0,0,05/07/21 2:04,08/10/20 9:47,"source: 5f7ee01e9ae56e6d7b8b49fb_0.jpg, label: johnnie-walker-black-label, order: 1, coverimage: 1",,"code: 5000267098463, qty: 1",https://alcohaul.sg/products/johnnie-walker-black-label-70cl,https://alcohaul.sg/api/productdetail/?slug=johnnie-walker-black-label-70cl,Johnnie Walker Black Label 70cl,Whisky,New AH,WSB012,43.3,1602150430,0,,,,,,,,,,,,,,johnnie walker
236,601d0d375f2f3d05388b4569,johnnie walker blue label 20cl,WSB013xxxx,Scotland,Speyside,Blended Whisky,40%,Y,200,"span style=""color: rgb(0, 0, 0); font-family: Arial; font-size: 13.3333px;"">A 20cl bottle of the renowned Johnnie Walker Blue Label blended Scotch whisky - a premium expression from the famous range.&nbsp;</span></p>
",0,9882,0,155,35.42,67.5,35.42,1,Buy Johnnie Walker Blue Label Whiskey 20cl Online in Singapore - Wholesale Alcohol Delivery,"buy Johnnie Walker Blue Label 20cl online, Johnnie Walker Blue Label 20cl delivery in singapore, Wholesale johnnie walker whisky delivery",Buy Johnnie Walker Blue Label 20cl whiskey online in Singapore. Order Johnnie Walker Blue Label online & get wholesale prices in Singapore.,johnnie-walker-blue-label,0,1,2,2,990,0,0,0,"dealerId: 5f7edc059ae56e6d7b8b4697, cost: 155",0,0,"   from_qty : 2,  to_qty : 5,  smartPrice : 65 ,   from_qty : 6,  to_qty : 10,  smartPrice : 64  ",johnnie-walker-blue-label-20cl,"5f7edb089ae56e6d7b8b459f, 5f7edb0e9ae56e6d7b8b45a6",0,"Scotland, Blended Whisky, 40% ABV",1,,0,0,10/03/21 8:08,05/02/21 9:17,"source: 601d0d375f2f3d05388b4569_0.jpg, label: Johnnie Walker Blue Label 20cl, order: 1, coverimage: 1",,,https://alcohaul.sg/products/johnnie-walker-blue-label-20cl,https://alcohaul.sg/api/productdetail/?slug=johnnie-walker-blue-label-20cl,Johnnie Walker Blue Label 75cl,Whisky,New AH,WSB013,155,1612516663,0,,,,,,,,,,,,,,johnnie walker
237,5f7ee01f9ae56e6d7b8b49fc,johnnie walker blue label 70cl,WSB013,Scotland,Speyside,Blended Whisky,40%,Y,700,"Awards: Master - Blended: Super Premium - 2014, The Scotch Whisky Masters (The Spirits Business) Double Gold - Blended Scotch - 2013, San Francisco World Spirits Competition Winner - Best Blended Scotch - 2013, San Francisco World Spirits Competition 2nd Place - Best Blended Whisky - 2015, International Whisky Competition Gold - Scotch Whisky - Deluxe Blend - 2014, International Wine &amp; Spirit Competition Silver Outstanding - Scotch Whisky - Deluxe Blend - 2017, International Wine &amp; Spirit Competition Silver - Blended: Super Premium - 2013, The Scotch Whisky Masters (The Spirits Business) Silver - Scotch Whisky - Deluxe Blend - 2013, International Wine &amp; Spirit Competition Johnnie Walker Blue Label is an exquisite blended scotch made from some of Scotlands rarest and most exceptional whiskies. Only one in every ten thousand casks has the elusive quality, character and flavour to deliver the remarkable signature taste of Johnnie Walker Blue Label. Johnnie Walker Blue Label has won more gold medals for excellence than any other super premium whisky. Supple and balanced with notes of chocolate, hints of grass, malt and a finish of floral, spice, smoke and honey. Nose: Fragrant with good body. Notes of oak, crisp spice, dried fruit, pastries. Berry fruits, aniseed, hints of cedar, a touch of spice and citrus. Palate: Supple and balanced. Good toffee and hints of very wistful smoke. Chocolate, hints of grass and a good hit of malt. Finish: Floral, oaky, good length, urged on by a plume of very well-kept, highland style smoke. Dried fruit, spice, honey. Overall: One of the ultimate premium blends, Blue Label is a legend in its own right and will continue to be.</p>
",0,946,0,155,155,182,155,1,Buy Johnnie Walker Blue Label 75cl Online - Free Delivery in Singapore,"Johnnie Walker Blue Label 75cl free delivery in singapore, buy Johnnie Walker Blue Label 75cl online SG, Johnnie Walker Blue Label 75cl delivery singapore",Order Johnnie Walker Blue Label 75cl in Singapore from our online Alcohol Delivery shop - Alcohaul. Buy Johnnie Walker Blue Label 75cl online & get free delivery above $100 anywhere in Singapore.,johnnie-walker-blue-label,0,1,2,2,990,0,0,0,"dealerId: 5f7edc059ae56e6d7b8b4697, cost: 155",0,0,"   from_qty : 2,  to_qty : 5,  smartPrice : 179 ,   from_qty : 6,  to_qty : 10,  smartPrice : 178  ",johnnie-walker-blue-label-70cl,"5f7edb089ae56e6d7b8b459f, 5f7edb0e9ae56e6d7b8b45a6",0,Johnnie Walker Blue Label 70cl,1,,0,0,02/07/21 6:44,08/10/20 9:47,"source: 5f7ee01f9ae56e6d7b8b49fc_0.jpg, label: johnnie-walker-blue-label, order: 1, coverimage: 1",E1-15-F,"code: 5000267115245, qty: 1",https://alcohaul.sg/products/johnnie-walker-blue-label-70cl,https://alcohaul.sg/api/productdetail/?slug=johnnie-walker-blue-label-70cl,Johnnie Walker Blue Label 75cl,Whisky,New AH,WSB013,155,1602150431,0,,,,,,,,,,,,,,johnnie walker
238,6062a5a65f2f3d7d1b8b4569,johnnie walker blue treasures of south east asia 70cl,WSB013LE,Scotland,Speyside,Blended Whisky,40%,Y,700,"span style=""color: rgb(0, 0, 0); font-family: Arial; white-space: pre-wrap;"">Johnnie Walker Blue Label Treasures of South East Asia, exclusively available in South East Asia markets, this limited edition design has been created by renowned graphic artist James Weston Lewis to bring to life the wonderful contrasts of South East Asia from its modern cities to its spectacular mountains and coastlines &ndash; ancient lands with progressive outlooks, nestled between the Indian and Pacific oceans. Nose Intricate aromas of cocoa-dusted nuts and dried fruits, sweet spices, leather, cedar, and earth Palate Flavors are influenced by the smoke of the west and the rich, sweet whiskies of the east Finish Long, evolving and contemplative fade with notes of peat and mossy earth in harmony</span></p>
",0,100,0,133.66,202.327,320,202.327,1,Buy Johnnie Walker Blue Treasures of South East Asia 70cl Online - Free Wholesale Delivery in Singapore,"Johnnie Walker Blue Treasures of South East Asia 70cl free delivery in singapore, buy Johnnie Walker Blue Treasures of South East Asia 70cl online SG, Johnnie Walker Blue Treasures of South East Asia 70cl delivery singapore, wholesale whisky delivery singapore",OrderJohnnie Walker Blue Treasures of South East Asia 70cl in Singapore from our online Alcohol Delivery shop - Alcohaul. Buy Johnnie Walker Blue Treasures of South East Asia 70cl online & get free delivery above $100 anywhere in Singapore.,johnnie-walker-xr-21-years,0,1,2,2,990,0,0,0,"dealerId: 5f7edafd9ae56e6d7b8b458f, cost: 133.66",0,0,"   from_qty : 2,  to_qty : 5,  smartPrice : 317 ,   from_qty : 6,  to_qty : 10,  smartPrice : 316  ",johnnie-walker-blue-treasures-of-south-east-asia-70cl,"5f7edb089ae56e6d7b8b459f, 5f7edb0e9ae56e6d7b8b45a6",0,"Scotland, Blended Whisky, 40% ABV",1,,0,0,30/03/21 4:14,30/03/21 4:14,"source: 6062a5a65f2f3d7d1b8b4569_0.jpg, label: Johnnie Walker Blue Treasures of South East Asia 70cl, order: 1, coverimage: 1",,,https://alcohaul.sg/products/johnnie-walker-blue-treasures-of-south-east-asia-70cl,https://alcohaul.sg/api/productdetail/?slug=johnnie-walker-blue-treasures-of-south-east-asia-70cl,Johnnie Walker Blue Treasures of South East Asia 70cl,Whisky,Johnnie Walker,WSB013LE,133.66,1617077670,0,,,,,,,,,,,,,,johnnie walker
239,5f7ee0219ae56e6d7b8b49fd,johnnie walker double black 70cl,WSB014,Scotland,Speyside,Blended Whisky,40%,Y,700,"Awards: Gold - Blended: Premium - 2015, The Scotch Whisky Masters (The Spirits Business) Gold - Blended Scotch - 2013, San Francisco World Spirits Competition Silver Outstanding - Scotch Whisky - Blended - 2017, International Wine & Spirit Competition Silver Outstanding - Scotch Whisky - Deluxe Blend - 2013, International Wine & Spirit Competition Silver - Scotch Whisky - Deluxe Blend - 2014, International Wine & Spirit Competition An intense and rich premium blend with a smouldering spiciness and powerful peat smoke finish. Bold flavour and iconic character - Johnnie Walker Black Label reinterpreted with a new level of intensity Johnnie Walker Double Black delivers a full-bodied and complex taste experience in a supremely smooth blend, with the signature peat smoke swirling through rich raisins and sultanas. Apples, pears and orange zest bring freshness while creamy vanilla and spice add a softness and sweetness to the tongue. Nose: Slightly smoky and almost medicinal on the nose, it offers up hints of vanilla, a little tar, a touch of barbecue sauce, citrus and malt. Palate: Good body and very creamy with a sublimely malty core. It offers up a surprising level of peat smoke which works really well. Creamy sweetness, hints of soft wood smoke, salty butter, custard and cereal grains. Finish: Good length with notes of malt, boiled sweets, black pepper and cool smoke.
",0,9762,0,55,55,67,67,1,Buy Johnnie Walker Double Black 70cl Online - Free Delivery in Singapore,"Johnnie Walker Double Black 70cl free delivery in singapore, buy Johnnie Walker Double Black 70cl online SG, Johnnie Walker Double Black 70cl delivery singapore",Order Johnnie Walker Double Black 70cl in Singapore from our online Alcohol Delivery shop - Alcohaul. Buy Johnnie Walker Double Black 70cl online & get free delivery above $100 anywhere in Singapore.,johnnie-walker-double-black,0,1,2,2,990,0,0,0,"dealerId: 5f7edb1b9ae56e6d7b8b45b4, cost: 55",0,0,"   from_qty : 2,  to_qty : 5,  smartPrice : 0 ,   from_qty : 6,  to_qty : 10,  smartPrice : 0  ",johnnie-walker-double-black-70cl,"5f7edb089ae56e6d7b8b459f, 5f7edb0e9ae56e6d7b8b45a6",0,Johnnie Walker Double Black 70cl,1,,0,0,20/06/21 1:03,08/10/20 9:47,"source: 5f7ee0219ae56e6d7b8b49fd_0.jpg, label: johnnie-walker-double-black, order: 1, coverimage: 1","E3-29-F,E3-30-F",,https://alcohaul.sg/products/johnnie-walker-double-black-70cl,https://alcohaul.sg/api/productdetail/?slug=johnnie-walker-double-black-70cl,Johnnie Walker Double Black 70cl,Whisky,New AH,WSB014,55,1602150433,0,,,,,,,,,,,,,,johnnie walker
240,5f7ee0229ae56e6d7b8b49fe,johnnie walker gold label reserve 75cl,WSB016,Scotland,Speyside,Blended Whisky,40%,Y,750,"Awards: Gold - Blended: Super Premium - 2015, The Scotch Whisky Masters (The Spirits Business) Gold - Scotch Whisky - Deluxe Blend - 2014, International Wine & Spirit Competition Silver - Scotch Whisky - Blended - 2017, International Wine & Spirit Competition Silver - Scotch Whisky - Deluxe Blend - 2013, International Wine & Spirit Competition Jim Beveridge blended Johnnie Walker Gold Label Reserve so that its flavours unfold in waves, with rich fruit and vanilla alongside spicy and sweet woody notes and a gentle smokiness. He has created a blend thats ideal for classic Scotch based cocktails because each of its distinct flavours can be enhanced through a choice of mixers and ingredients like its rich vanilla notes that work so well in a zesty Whisky Sour or bringing its sweet fruitiness to the fore in a tall glass with crushed ice and a slice of fresh orange. Nose: Honey and heather with thick caramel notes and a subtle nutmeg spice. Dried meadow flowers and a hint of fresh banana. Palate: Smooth and succulent with a honeyed sweetness that's typical of Johnnie Walker. There's more to this though, the floral elements are quite prominent and there's a spiced sweet vanilla note too. Finish: Long, sweet and toffee-like. Overall: A typically easy drinking blend from Johnnie Walker, this will not disappoint fans of the style.
",0,9747,0,57.8,57.8,74.9,74.9,1,Buy Johnnie Walker Gold Label Reserve 75cl Online - Free Delivery in Singapore,"Johnnie Walker Gold Label Reserve 75cl free delivery in singapore, buy Johnnie Walker Gold Label Reserve 75cl online SG, Johnnie Walker Gold Label Reserve 75cl delivery singapore",Order Johnnie Walker Gold Label Reserve 75cl in Singapore from our online Alcohol Delivery shop - Alcohaul. Buy Johnnie Walker Gold Label Reserve 75cl online & get free delivery above $100 anywhere in Singapore.,johnnie-walker-gold-label,0,1,2,2,990,0,0,0,"dealerId: 5f7edc079ae56e6d7b8b4699, cost: 57.8",0,0,"   from_qty : 2,  to_qty : 5,  smartPrice : 0 ,   from_qty : 6,  to_qty : 10,  smartPrice : 0  ",johnnie-walker-gold-label-reserve-75cl,"5f7edb089ae56e6d7b8b459f, 5f7edb0e9ae56e6d7b8b45a6",0,Johnnie Walker Gold Label Reserve 75cl,1,,0,0,02/07/21 8:50,08/10/20 9:47,"source: 5f7ee0229ae56e6d7b8b49fe_0.jpg, label: johnnie-walker-gold-label, order: 1, coverimage: 1",F2-5-F,"code: 5000267107776, qty: 1",https://alcohaul.sg/products/johnnie-walker-gold-label-reserve-75cl,https://alcohaul.sg/api/productdetail/?slug=johnnie-walker-gold-label-reserve-75cl,Johnnie Walker Gold Label Reserve 75cl,Whisky,New AH,WSB016,57.8,1602150434,0,,,,,,,,,,,,,,johnnie walker
241,5f7ee0409ae56e6d7b8b4a15,johnnie walker green label 15yrs 70cl,WSB044,Scotland,Speyside,Blended Whisky,40%,Y,700,"Awards:Gold - Liquid Gold Award - 2014, Jim Murray&#39;s Whisky Bible Silver - Scotch Whisky - Blended Malt - 2017, International Wine &amp; Spirit Competition A blended malt from Johnnie Walker, Jim Murray awarded this 15 year old a whopping 95 points in his 2010 Whisky Bible! The nose is quite rich and full. There are notes of mocchaccino and espresso coffee, wood smoke and a fireplace, a touch of bitter chocolate and oak. The palate is of medium-body with notes of crisp cereals, coffee beans and chocolate, a date note with a touch of walnut. The finish is quite long and spicy with honeyed sweetness and oak.</p>
",0,87,0,395,65.83,95,65.83,6,Buy Johnnie Walker Green Label 15yrs 70cl Online - Free Delivery in Singapore,"Johnnie Walker Green Label 15yrs 70cl free delivery in singapore, buy Johnnie Walker Green Label 15yrs 70cl online SG, Johnnie Walker Green Label 15yrs 70cl delivery singapore",Order Johnnie Walker Green Label 15yrs 70cl in Singapore from our online Alcohol Delivery shop - Alcohaul. Buy Johnnie Walker Green Label 15yrs 70cl online & get free delivery above $100 anywhere in Singapore.,johnnie-walker-green-label-700ml,0,1,2,2,990,0,0,0,"dealerId: 5f7edb1b9ae56e6d7b8b45b4, cost: 65.83",0,0,"   from_qty : 2,  to_qty : 5,  smartPrice : 92 ,   from_qty : 6,  to_qty : 10,  smartPrice : 91  ",johnnie-walker-green-label-15yrs-70cl,"5f7edb089ae56e6d7b8b459f, 5f7edb0e9ae56e6d7b8b45a6",0,Johnnie Walker Green Label 15yrs 70cl,1,,0,0,15/06/21 0:11,08/10/20 9:47,"source: 5f7ee0409ae56e6d7b8b4a15_0.jpg, label: johnnie-walker-green-label-700ml, order: 1, coverimage: 1",D2-23-F,,https://alcohaul.sg/products/johnnie-walker-green-label-15yrs-70cl,https://alcohaul.sg/api/productdetail/?slug=johnnie-walker-green-label-15yrs-70cl,Johnnie Walker Green Label 15yrs 70cl,Whisky,New AH,WSB044,65.83,1602150464,0,,,,,,,,,,,,,15yr,johnnie walker
242,601d0d8e5f2f3d2d388b4568,johnnie walker green label 20cl,WSB013xxxx2,Scotland,Speyside,Blended Whisky,40%,Y,200,"span style=""color: rgb(0, 0, 0); font-family: Arial; font-size: 13.3333px;"">A 20cl bottle of the renowned Johnnie Walker Blue Label blended Scotch whisky - a premium expression from the famous range.&nbsp;</span></p>
",0,9883,0,155,26.96,48.5,26.96,1,Buy Johnnie Walker Green Label Whiskey 20cl Online in Singapore - Wholesale Alcohol Delivery,"buy Johnnie Walker Green Label 20cl online, Johnnie Walker Green Label 20cl delivery in singapore, wholesale whisky delivery Johnnie Walker Green Label",Buy Johnnie Walker Green Label 20cl whiskey online in Singapore. Order Johnnie Walker Green Label online & get wholesale alcohol delivery in Singapore.,johnnie-walker-blue-label,0,1,2,2,990,0,0,0,"dealerId: 5f7edc059ae56e6d7b8b4697, cost: 155",0,0,"   from_qty : 2,  to_qty : 5,  smartPrice : 46 ,   from_qty : 6,  to_qty : 10,  smartPrice : 45  ",johnnie-walker-green-label-20cl,"5f7edb089ae56e6d7b8b459f, 5f7edb0e9ae56e6d7b8b45a6",0,"Scotland, Blended Whisky, 40% ABV",1,,0,0,21/04/21 3:28,05/02/21 9:19,"source: 601d0d8e5f2f3d2d388b4568_0.jpg, label: Johnnie Walker Green Label 20cl, order: 1, coverimage: 1",,,https://alcohaul.sg/products/johnnie-walker-green-label-20cl,https://alcohaul.sg/api/productdetail/?slug=johnnie-walker-green-label-20cl,Johnnie Walker Blue Label 75cl,Whisky,New AH,WSB013,155,1612516750,0,,,,,,,,,,,,,,johnnie walker
