url,api,name,discount_price,price,brand,description,oos,name_in_english
"https://www.ishopchangi.com/en/product/johnnie-walker-black-label-70cl-mp00094456.html?p_collection=HOMEDELIVERYNONTRAVELLER,LANDSIDE#referer=categorylisting",https://www.ishopchangi.com/en/product/johnnie-walker-black-label-70cl-mp00094456.model.json, BLACK LABEL 70CL,92.0,92.0,JOHNNIE WALKER,"Johnnie Walker Black Label is a true icon, recognised as the benchmark for all other deluxe blends. Created using only whiskies aged for a minimum of 12 years from the four corners of Scotland, Johnnie Walker Black Label has an unmistakably smooth, deep character. An impressive whisky to share on any occasion, whether you're entertaining at home or on a night out with friends.

Tasting Notes

NOSE

Take in the luxurious scent of rich and tropical dark fruits with hints of sweet vanilla.

PALATE

Savour the depth of flavour developed from maturation in oak casks, combined with creamy toffee notes that come from grain whiskies.

FINISH

This iconic whisky delivers a smooth and warming smoke finish, characteristic of all Johnnie Walker whiskies.",,JOHNNIE-WALKER-BLACK-LABEL-70CL
"https://www.ishopchangi.com/en/product/laphroaig-25-years-single-malt-whisky-mp00105337.html?p_collection=HOMEDELIVERYNONTRAVELLER,LANDSIDE#referer=categorylisting",https://www.ishopchangi.com/en/product/laphroaig-25-years-single-malt-whisky-mp00105337.model.json, 25 Years Single Malt Whisky,740.9,899.0,LAPHROAIG,"<p>2018 Edition<br /> <br /> The Laphroaig 25 Years Single Malt Whisky is the perfect marriage of sherried, oaky flavours from the European Oloroso Sherry Casks and the creamy, smooth, sweet flavours from the ex-American Bourbon Barrels. The Oloroso Sherry Casks and ex-American Bourbon Barrels were filled with newly distilled Laphroaig spirit from day one.<br /> <br /> Bottled at Cask Strength, it is a perfect fusion of these two most different styles of maturation flavours, made even smoother by the 25 years it has had gently maturing.<br /> <br /> Colour: Bright red gold<br /> Nose: The initial sweet, sherry sweetness is quickly followed but the time-honoured Islay peat fang<br /> Palate: Rich round and full, the burst of peat that fills the mouth is quickly restrained by a sherry sweetness that slowly develops into<br /> spicy apple fruitiness<br /> Finish: Very long &amp; warming, leaving a distinct tang of Islay.</p>",,Laphroaig-25-Years-Single-Malt-Whisky
"https://www.ishopchangi.com/en/product/laphroaig-30-years-single-malt-whisky-mp00105349.html?p_collection=HOMEDELIVERYNONTRAVELLER,LANDSIDE#referer=categorylisting",https://www.ishopchangi.com/en/product/laphroaig-30-years-single-malt-whisky-mp00105349.model.json, 30 Years Single Malt Whisky,991.9,1199.0,LAPHROAIG,"<p>2007 Best Islay Whisky Aged 21 Years &amp; Over <br /> <br /> Like the wave-washed granite walls of our distillery, this rare bottle of Laphroaig&reg; has acquired a rounded character and exceptional smoothness.<br /> <br /> Savour Laphroaig&reg; 30 Year Old while you can. Moments such as this come but once in a lifetime.<br /> <br /> Colour: Bright gold<br /> Nose: Ripe tropical fruits, toasted macadamia nuts and more than a hint of vanilla cream.<br /> Palate: Smoke, tempered by lime and nectarine, giving way to sea salt and mild chilli.<br /> Finish: Antique leather and green tobacco leaf.</p>",,Laphroaig-30-Years-Single-Malt-Whisky
"https://www.ishopchangi.com/en/product/laphroaig-triplewood-single-malt-whisky-mp00105328.html?p_collection=HOMEDELIVERYNONTRAVELLER,LANDSIDE#referer=categorylisting",https://www.ishopchangi.com/en/product/laphroaig-triplewood-single-malt-whisky-mp00105328.model.json, Triplewood Single Malt Whisky,109.9,149.0,LAPHROAIG,"<b>Images shown are for illustration purposes only, vintage may vary.</b><br /><br /><p>Triple Wood is an extension of the Quarter Cask expression and is special for its triple maturation, which creates a unique blend of our signature peat-smoked liquid with softer notes of fruit and spices. First maturing in ex-bourbon barrels, second maturation in quarter casks and then a third maturation in European oak casks previously used for Oloroso sherry.<br /> <br /> This final stage allows for a slow maturation &ndash; all leading to a soft, complex and fully rounded flavour. When tasted, Triple Wood begins with a subtle sherry sweetness before offering up spiciness and nuttiness and a huge peat flavour.<br /> <br /> Nose: Sweet raisins and creamy apricots, nuttiness, bonfire ash and earthy peat.<br /> Palate: Creamy flavours of vanilla and fruit, with a suggestion of sherry sweetness<br /> Finish: Mouth-filling and extremely long, balanced by a sweet smooth caramel taste.</p>",,Laphroaig-Triplewood-Single-Malt-Whisky
"https://www.ishopchangi.com/en/product/hyde-no-8-1640-43--700ml-mp00108311.html?p_collection=HOMEDELIVERYNONTRAVELLER,LANDSIDE#referer=categorylisting",https://www.ishopchangi.com/en/product/hyde-no-8-1640-43--700ml-mp00108311.model.json, NO.8 1640 43% 700ML,60.0,0.0,HYDE,"<b>Images shown are for illustration purposes only, vintage may vary.</b><br /><br /><p>Heritage Cask Single Grain - 75% Single Grain; Bourbon Cask Matured. 25% Single Malt Sherry Cask Matured.  This HYDE #8 expression is a triple distilled Irish whiskey slowly finished in a full bodied craft Irish Stout cask from the Cotton Ball Craft Brewery in Cork City. </p><br /><p>Cotton Ball, five grain, Irish Stout aged in a first fill ex-Bourbon, flame charred, Oak cask for 3 months. Triple distilled HYDE Irish whiskey aged in the Cotton Ball Stout infused oak cask for a further 6 months. </p><br /><p>Tasting Notes: <br /><br />- NOSE: A distinctive full bodied malty aroma with sweet vanilla and roasted coffee bean overtones. <br /><br />- TASTE: Sweet, hoppy, biscuit taste, with a distinctive roasted coffee bean twist. <br /><br />- FINISH: Sweet caramel, perfectly balanced with a long, smooth, creamy finish... Sláinte! </p><br /><br /><p>HYDE Irish Whiskey is matured and ‘finished’ to perfection in the idyllic landscape and temperate climate of County Cork, on the Wild Atlantic way coast in south west Ireland. County Cork is a coastal region with an exceptional micro climate not found anywhere else in Ireland with warm summers and mild winters. The warm Atlantic Gulf stream provides Cork with the perfectly temperate, oceanic, micro-climate for maturing HYDE Irish whiskey casks. The region has one of the mildest and most temperate climates in Western Europe. Never too hot – Never too cold – Just right for maturing great tasting Irish whiskey!</p> <br /><p><br />- 75% Single Grain; fully matured in a first fill, flame charred, bourbon cask.<br /><br />- 25% Single Malt; fully matured in a first fill, toasted, Oloroso sherry cask.<br /><br />- Non chill filtered.<br /><br />- Internationally acclaimed. </p>",,HYDE-NO-8-1640-43--700ML
"https://www.ishopchangi.com/en/product/hibiki-harmony-japanese-whisky-mp00093954.html?p_collection=HOMEDELIVERYNONTRAVELLER,LANDSIDE#referer=categorylisting",https://www.ishopchangi.com/en/product/hibiki-harmony-japanese-whisky-mp00093954.model.json, Harmony Japanese Whisky,162.0,179.0,HIBIKI,"<b>Images shown are for illustration purposes only, vintage may vary.</b><br /><br /><p><span style=""color:blue; font-weight: bold;"">Note: This item will be delivered separately if the order contains items from other merchants</span></p><br><br><br />Luminous & delicate. A transparency that unveils complexity.<br /><br />From its launch, Hibiki Whisky has been embraced as the paragon of The Art of Japanese Whisky, the very product of Japanese nature and her people. Hibiki Whisky is not only Japan’s most highly awarded blended whisky, but among the most prestigious and honoured whiskies in the world.<br /><br /><br />Colour:	Amber<br />Nose:	Rose, lychee, hint of rosemary, mature woodiness, sandalwood<br />Palate:	Honeylike sweetness, candied orange peel, white chocolate<br />Finish:	Subtle, tender long finish with hint of Mizunara (Japanese oak) <br /><br /><p><span style=""font-weight: bold;"">List price includes Duty.</span><p>",,Hibiki-Harmony-Japanese-Whisky
"https://www.ishopchangi.com/en/product/yamazaki-12-years-japanese-whisky-mp00093948.html?p_collection=HOMEDELIVERYNONTRAVELLER,LANDSIDE#referer=categorylisting",https://www.ishopchangi.com/en/product/yamazaki-12-years-japanese-whisky-mp00093948.model.json, 12 Years Japanese Whisky,282.0,329.0,YAMAZAKI,"Yamazaki 12 Years Japanese Whisky; succulent with soft fruits.

Yamazaki whisky is Suntory's flagship single malt, multi-layered with fruit & Mizunara aromas.

From Yamazaki was born the surprising, delicate yet profound experience of a Japanese single malt whisky. Spiritual and deep, its signature multi-layered taste is highly praised by whisky connoisseurs all over the world.

Colour:	Pure gold
Nose:	Peach, pineapple, grapefruit, clove, candied orange, vanilla, Mizunara (Japanese oak)
Palate:	Coconut, cranberry, butter
Finish:	Long finish sweet ginger & cinnamon. 

<p><span style=""font-weight: bold;"">List price includes Duty.</span><p>",,Yamazaki-12-Years-Japanese-Whisky
"https://www.ishopchangi.com/en/product/suntory-chita-single-grain-japanese-whisky-mp00093950.html?p_collection=HOMEDELIVERYNONTRAVELLER,LANDSIDE#referer=categorylisting",https://www.ishopchangi.com/en/product/suntory-chita-single-grain-japanese-whisky-mp00093950.model.json,Suntory  Single Grain Japanese Whisky,77.9,109.0,CHITA,"<b>Images shown are for illustration purposes only, vintage may vary.</b><br /><br /><p><span style=""color:blue; font-weight: bold;"">Note: This item will be delivered separately if the order contains items from other merchants</span></p><br><br><br />This single grain whisky was made with diverse unblended whisky brewing techniques and master craftsmanship developed over many years at the Chita Distillery in Aichi Prefecture. It features a light taste and delicately sweet fragrance.<br /><br />Colour:	Bright gold<br />Nose:	Creme brulee, cardamom, acacia honey, blossoming rose<br />Palate:	Mild and smooth, hint of mint, deep honey<br />Finish:	Clean and clear, spiced oak with subtle bittersweet notes <br /><br /><p><span style=""font-weight: bold;"">List price includes Duty.</span><p>",,Suntory-Chita-Single-Grain-Japanese-Whisky
"https://www.ishopchangi.com/en/product/yamazaki-distiller-s-reserve-japanese-whisky-mp00093952.html?p_collection=HOMEDELIVERYNONTRAVELLER,LANDSIDE#referer=categorylisting",https://www.ishopchangi.com/en/product/yamazaki-distiller-s-reserve-japanese-whisky-mp00093952.model.json, Distiller's Reserve Japanese Whisky,169.9,199.0,YAMAZAKI,"<b>Images shown are for illustration purposes only, vintage may vary.</b><br /><br /><p><span style=""color:blue; font-weight: bold;"">Note: This item will be delivered separately if the order contains items from other merchants</span></p><br><br><br />Yamazaki whisky is Suntory's flagship single malt, multi-layered with fruit & Mizunara aromas.<br /><br />From Yamazaki was born the surprising, delicate yet profound experience of a Japanese single malt whisky. Spiritual and deep, its signature multi-layered taste is highly praised by whisky connoisseurs all over the world.<br /><br /><br />Colour:	Gold<br />Nose:	Strawberry, cherry, Mizunara (Japanese oak)<br />Palate:	Raspberry, white peach, touch of coconut<br />Finish:	Sweet vanilla, clear finish with, hint of cinnamon <br /><br /><p><span style=""font-weight: bold;"">List price includes Duty.</span><p>",,Yamazaki-Distiller-s-Reserve-Japanese-Whisky
"https://www.ishopchangi.com/en/product/hakushu-12-years-japanese-whisky-mp00093955.html?p_collection=HOMEDELIVERYNONTRAVELLER,LANDSIDE#referer=categorylisting",https://www.ishopchangi.com/en/product/hakushu-12-years-japanese-whisky-mp00093955.model.json, 12 Years Japanese Whisky,269.9,329.0,HAKUSHU,"<p><span style=""color:blue; font-weight: bold;"">Note: This item will be delivered separately if the order contains items from other merchants</span></p><br><br>
Hakushu 12 Years Japanese Whisky; the Hakushu Distillery is without question one of the highest distilleries in the world. Built amidst the deepest forests of Mt. Kaikomagatake in the Japanese Southern Alps.

Colour:	Champagne gold.
Nose:	Basil, pine needle, green apple.
Palate:	Sweet pear, mint, kiwi
Finish:	Green tea, subtle smoke. 

<p><span style=""font-weight: bold;"">List price includes Duty.</span><p>",,Hakushu-12-Years-Japanese-Whisky
"https://www.ishopchangi.com/en/product/kamiki-sakura-malt-whisky-500ml-48--mp00115494.html?p_collection=HOMEDELIVERYNONTRAVELLER,LANDSIDE#referer=categorylisting",https://www.ishopchangi.com/en/product/kamiki-sakura-malt-whisky-500ml-48--mp00115494.model.json,KAMIKI SAKURA MALT WHISKY 500ML 48%,100.8,126.0,KAMIKI WHISKY,"<b>Images shown are for illustration purposes only, vintage may vary.</b><br /><br />Kamiki is a new expression of premium Japanese style whisky blessed by Omiwa priests from Nara. Nara is the ancient capital of Japan and it holds many temples from Shinto, Tengri and Buddhist religions, which makes Nara «The City of Temples». Kamiki production is protected by Omiwa Temple priests. Omiwa is one of the oldest extant Shinto shrine in Japan over thousand years old and protecting local alcohol producers ever since. To celebrate the timeless alcohol tradition of the region, rare Japanese malt whiskies and finest malt whiskies sourced from rest of the world are blended and later fused with the highest quality pure spring water. Nara is covered with dense Yoshino Sugi (Japanese Cedar) forests. Yoshino Sugi is used to build temples, burnt in temples to calm mind and to age local alcohol products. Kamiki uses a unique second maturation technique, while blend is rested for a second time in Yoshino Sugi –Japanese Cedar- casks to capture a perfectly smooth taste, a scent of sandalwood on the nose and a zest of green tea in the finish. This second maturation makes Kamiki; “THE FIRST WHISKY IN THE WORLD WITH JAPANESE CEDAR CASK FINISH”! Kamiki name is derived from the Miwa Mountain (Mountain of God), which is protected by Omiwa Priests. Inspired by beautiful breezes coming from Miwa, the whisky is named KAMIKI, where KAMI means God and IKI means breath. Nara is as well home to Thousands of Sakura Trees, planted long ago by priests to worship nature. Sakura tree symbolizes the fragility of life with its beautiful yet short-lived blossoms and has been part of Japanese culture for centuries through the spring ceremony of HANAMI – Cherry Blossom viewing. Inspired by sacred Sakura tree and timeless traditions of Nara, we curated Kamiki SAKURA. Kamiki SAKURA is an exclusive version of Kamiki ORIGINAL whereby the blend is aged in Sakura casks at the final stage after it is rested in Yoshino-Sugi casks. This two-step cask finish brings the essence Yoshino Sugi and Sakura wood with a distinct warming woodiness that reminds Nara forests with sandalwood and gentle spice, before sweet cherries notes. There is no age statement on the product. It has been aged in oak barrels minimum of three years and second aged in non-charred local cedar casks and finally Sakura casks to bring the taste of Nara forests in a whisky bottle to the world. Kamiki SAKURA has got acknowledgements from: <br />•	“DOUBLE GOLD” medal from 2019 Cigar & Spirits Magazine Competition <br />•	“GOLD” medal from 2019 China Wine and Spirits Awards. <br />•	“91 Points” from 2020 Ultimate Spirit Challange. <br />•	“PLATINUM” Award from 2019 SIP Awards <br />•	“DOUBLE GOLD” Award from 2019 Women’s Wine & Spirit Awards. <br />•	“CONSUMER’S CHOICE” Award from 2019 SIP Awards <br />•	“INNOVATION” Award from 2019 SIP Awards <br />•	“DOUBLE GOLD” from 2019 Las Vegas Spirit Awards<br />•	“GOLD” from 2019 San Diego Spirit Awards TASTING NOTES <br />•	Nose: Cherry candy with ripe banana, chestnuts, and cinnamon on the nose.<br />•	Palate: Woodiness, sandalwood and gentle spice, before sweet Sakura pedals. <br />•	Finish: Spicy cherry with savory notes, leading to a floral, spring-like finish",,KAMIKI-SAKURA-MALT-WHISKY-500ML-48-
"https://www.ishopchangi.com/en/product/hakushu-distiller-s-reserve-700ml-mp00089082.html?p_collection=HOMEDELIVERYNONTRAVELLER,LANDSIDE#referer=categorylisting",https://www.ishopchangi.com/en/product/hakushu-distiller-s-reserve-700ml-mp00089082.model.json, DISTILLER'S RESERVE 700ML,124.0,0.0,HAKUSHU,"<b>Images shown are for illustration purposes only, vintage may vary.</b><br /><br />Hakushu is the verdant single malt Japanese whisky born in Suntory's mountain forest distillery. Made from water with a rare softness and maturing in a lush forested microclimate, Hakushu's renowned single malt Japanese whiskies are blessed by the region's ever-changing seasons—each leaving their own verdant signature. Refreshingly herbal and gently smoky, Hakushu is embraced as the intriguing single malt Japanese whisky from the award-winning House of Suntory Whisky.",,HAKUSHU-DISTILLER-S-RESERVE-700ML
"https://www.ishopchangi.com/en/product/umiki-whisky-750ml-46--mp00115618.html?p_collection=HOMEDELIVERYNONTRAVELLER,LANDSIDE#referer=categorylisting",https://www.ishopchangi.com/en/product/umiki-whisky-750ml-46--mp00115618.model.json, 750ML 46%,83.88,93.2,UMIKI WHISKY,"<b>Images shown are for illustration purposes only, vintage may vary.</b><br /><br />The ocean is known as source of life, the ever-green pine tree is known as the symbol of life in Japan with its endurance to harsh conditions (sea salt spray & wind). Matsu - Pine tree - is planted in coastlines to protect against ocean erosion and tsunamis and has a special place in the heart of Japanese culture. To honor the life-giving ocean and the long-living pine tree that graces the coasts of Japan, we blended filtered desalinated ocean-water from depths of Pacific ocean with Japanese ocean-side distilled malt whiskies and grain whiskies from abroad after finishing our curation in Japanese Pine barrels! This unique production process gave name to our whisky its name UMIKI whereby UMI means OCEAN and KI means TREE in Japanese.Umiki Whisky’ s unique production technique gives a sea breeze on the nose, a soothing freshness in the finish to our whisky. Our design inspired by the water and tree circle aged lines. We blend these visuals like our Ocean Fused Whisky UMIKI.  UMIKI is committed to inspire and share the value of living in harmony with our beautiful planet through its life time.  <br /><br /> TASTING NOTES <br />• Nose: A hint of sea breeze and sweet floral and sea weed notes on the nose <br />• Palate: Soothing freshness on the palate with hints of mint<br />• Finish: Long and burst of heather honey smooth finish at the end.<br /><br />Umiki has got acknowledgements from: <br />• “ Double Gold Awarded from China Wine & Spirits Awards 2020 Competition” <br />• “Gold Awarded from World & Spirits Award 2020 Competition” <br />• “Gold Awarded from World Whisky Masters 2020” <br />• “Bronze Awarded from London Spirits Competition 2020” <br />• “Gold” medal from SIP Awards 2020 <br />• “Innovation Award” from SIP Awards 2020",,UMIKI-WHISKY-750ML-46-
"https://www.ishopchangi.com/en/product/kura-reki-whisky-750ml-43--mp00115509.html?p_collection=HOMEDELIVERYNONTRAVELLER,LANDSIDE#referer=categorylisting",https://www.ishopchangi.com/en/product/kura-reki-whisky-750ml-43--mp00115509.model.json,KURA REKI WHISKY 750ML 43%,79.84,99.8,HELIOS,"<b>Images shown are for illustration purposes only, vintage may vary.</b><br /><br />“From Okinawa to The World”...<br />Reki Blended Whisky is the latest premium Japanese Whisky expression of multiple award winning Helios Distillery from Okinawa Island. <br />Situated in Nago-city, the Northern Area of Okinawa that is known for its rich natural environment, Helios has placed high value on preservation of the environment and making the best use of Okinawa’s natural resources and history, and dedicate to produce authentic and good products. <br />Based on the principal, Tadashi Matsuda, the founder, Helios Co. has been distilling spirits over 50 years and promoting the identity, culture, and know-how of Okinawa. This is why, company’s main theme is “From Okinawa to The World”! <br />Reki Blended Whisky, is the latest product from Helios. It is blended whisky made with malted barley, grain, yeast and water using the years of productions experience of Helios Distillery. <br />Being originally a Japanese Rum producer, Helios Co. uses ex-American barrels for its rum production, hence Reki the whisky is as well aged in ex-bourbon barrels to attain a perfectly balanced whisky with hints of tropical fruits, vanilla a seaweed. <br />The blend consists of malt whiskies distilled at Helios, while the blend is younger than three years. <br />Reki Blended Whisky is: <br />•	-  “An exclusive whisky from multiple award winning Helios distillery” <br />•	-  “Limited allocation around the world.” <br />•	-  “Represent the true heritage and made with the best ingredients from Okinawa Island” <br />•	-  “Gold Medal” winner from Stuttgart International Spirits Competition 2019 <br />TASTING NOTES <br />Nose: Tropical fruits, citrus blended with honey and hints of vanilla and Japanese rum <br />Palate: Sweet caramel with vanilla notes up front, joined with tropical citrus fruits balanced with peat from oak barrels<br />Finish: Hints of toffee filled with rum, sea weed and orange oil with toasty cereals with vanilla coating",,KURA-REKI-WHISKY-750ML-43-
"https://www.ishopchangi.com/en/product/-bundle--yamazaki-12-year---hakushu-distiller-reserve-mp00097720.html?p_collection=HOMEDELIVERYNONTRAVELLER,LANDSIDE#referer=categorylisting",https://www.ishopchangi.com/en/product/-bundle--yamazaki-12-year---hakushu-distiller-reserve-mp00097720.model.json,[BUNDLE]  12 Year + Hakushu Distiller Reserve,451.0,483.0,YAMAZAKI,"<b>Images shown are for illustration purposes only, vintage may vary.</b><br /><br /><p>Bundle consist of: <br /> <br /> 1x Yamazaki 12 Years 700ml<br /> 1x Hakushu Distillers Reserve 700ml<br /> <br /> Yamazaki 12 Years<br /> <br /> Yamazaki 12 Years Japanese Whisky; succulent with soft fruits. Yamazaki whisky is Suntory's flagship single malt, multi-layered with fruit &amp; Mizunara aromas. From Yamazaki was born the surprising, delicate yet profound experience of a Japanese single malt whisky. Spiritual and deep, its signature multi-layered taste is highly praised by whisky connoisseurs all over the world. <br /> <br /> Colour: Pure gold<br /> Nose: Peach, pineapple, grapefruit, clove, candied orange, vanilla, Mizunara (Japanese oak)<br /> Palate: Coconut, cranberry, butter<br /> Finish: Long finish sweet ginger &amp; cinnamon.<br /> <br /> Hakushu Distiller Reserve<br /> <br /> Fresh with citric notes. Built amidst the deepest forests of Mt. Kaikomagatake in the Japanese Southern Alps, the Hakushu Distillery is without question one of the highest distilleries in the world.<br /> <br /> Colour: Light gold<br /> Nose: Peppermint, melon, cucumber<br /> Palate: Yuzu, grapefruit, lemon thyme<br /> Finish: Refreshing, subtle smoke</p>",,-BUNDLE--Yamazaki-12-Year---Hakushu-Distiller-Reserve
"https://www.ishopchangi.com/en/product/shinsei-japanese-whisky-40--700ml-mp00112327.html?p_collection=HOMEDELIVERYNONTRAVELLER,LANDSIDE#referer=categorylisting",https://www.ishopchangi.com/en/product/shinsei-japanese-whisky-40--700ml-mp00112327.model.json, JAPANESE WHISKY 40% 700ML,77.04,96.3,SHINSEI,"<b>Images shown are for illustration purposes only, vintage may vary.</b><br /><br />Shinsei reveals very light woody and smoky scents with fruity aromas ( pear, quince, citrus, pineapple, cherry ) on the palate. Its rich texture reveals sweet notes of butter biscuits and liquorice with spicy hints and a very smooth finish of incense notes..",,SHINSEI-JAPANESE-WHISKY-40--700ML
