url,api,name,discount_price,price,brand,description,oos,name_in_english
"https://www.ishopchangi.com/en/product/highland-park-12-year-old-700ml-mp00107321.html?p_collection=HOMEDELIVERYNONTRAVELLER,LANDSIDE#referer=categorylisting",https://www.ishopchangi.com/en/product/highland-park-12-year-old-700ml-mp00107321.model.json, 12 Year Old 700ml,98.0,120.0,HIGHLAND PARK,"The abiding care and attention, the hallmarks of Highland Park production, manifests itself in the distinctive aromatic, full-bodied floral sweetness of the whisky. The harmony between peated and un-peated malt and between European and American oak during maturation results in a fine balance of sweetness and smokiness.<br /><br /><p><span style=""font-weight:bold;"">Colour: </span></p><br /><p>Glowing amber</p><br><br><br /><p><span style=""font-weight:bold;"">Nose : </span></p><br /><p>Heather-honey sweetness, peaty smokiness</p><br><br><br /><p><span style=""font-weight:bold;"">Palate : </span></p><br /><p>Rounded smoky sweetness, full malt delivery</p><br /><p><span style=""font-weight:bold;"">Finish : </span></p>Teasing, heathery, delicious",,Highland-Park-12-Year-Old-700ml
"https://www.ishopchangi.com/en/product/bunnahabhain-2008-manzanilla-700ml-limited-edition-52-3--mp00131027.html?p_collection=HOMEDELIVERYNONTRAVELLER,LANDSIDE#referer=categorylisting",https://www.ishopchangi.com/en/product/bunnahabhain-2008-manzanilla-700ml-limited-edition-52-3--mp00131027.model.json, 2008 MANZANILLA 700ML LIMITED EDITION 52.3%,200.0,0.0,BUNNAHABHAIN,This limited edition is a marriage of coastal flavours matured in former Manzanilla sherry casks for 11 years. Delivering a salted caramel and rich oak character.,,BUNNAHABHAIN-2008-MANZANILLA-700ML-LIMITED-EDITION-52-3-
"https://www.ishopchangi.com/en/product/kavalan-solist-fino-sherry-single-cask-strength-single-malt-whisky-58-6--1000ml-mp00123649.html?p_collection=HOMEDELIVERYNONTRAVELLER,LANDSIDE#referer=categorylisting",https://www.ishopchangi.com/en/product/kavalan-solist-fino-sherry-single-cask-strength-single-malt-whisky-58-6--1000ml-mp00123649.model.json, SOLIST FINO SHERRY SINGLE CASK STRENGTH SINGLE MALT WHISKY 58.6% 1000ML,373.0,0.0,KAVALAN,"<b>Images shown are for illustration purposes only, vintage may vary.</b><br /><br />Fino, Spanish for 'Fine', is the driest and palest of all varieties of traditional sherry wine. Traditional Fino wine is usually dry and is best consumed shortly after the bottle is opened in order to avoid losing its flavour. Kavalan's Fino, matured in the finest Fino Sherry butts, however, provides mild sweetness that excites the palate.",,KAVALAN-SOLIST-FINO-SHERRY-SINGLE-CASK-STRENGTH-SINGLE-MALT-WHISKY-58-6--1000ML
"https://www.ishopchangi.com/en/product/loch-lomond-inchmurrin-madeira-wood-finish-single-malt-scotch-whisky-1000ml-mp00088587.html?p_collection=HOMEDELIVERYNONTRAVELLER,LANDSIDE#referer=categorylisting",https://www.ishopchangi.com/en/product/loch-lomond-inchmurrin-madeira-wood-finish-single-malt-scotch-whisky-1000ml-mp00088587.model.json, INCHMURRIN MADEIRA WOOD FINISH SINGLE MALT SCOTCH WHISKY 1000ML,105.0,0.0,Loch Lomond,"<b>Images shown are for illustration purposes only, vintage may vary.</b><br /><br />Our master distiller bill white selects individual casks matured exclusively in traditional american oak whisky barrels before marrying them together for a further maturation in casks that have previously been used for making fortified madeira wine. The madeira cask finish enhances the orchard fruit character of peach and pear with marzipan and nutmeg and gives a dry nuttiness to the long, oak finish.",,LOCH-LOMOND-INCHMURRIN-MADEIRA-WOOD-FINISH-SINGLE-MALT-SCOTCH-WHISKY-1000ML
"https://www.ishopchangi.com/en/product/loch-lomond-inchmoan-10-year-old-1000ml-46--mp00139518.html?p_collection=HOMEDELIVERYNONTRAVELLER,LANDSIDE#referer=categorylisting",https://www.ishopchangi.com/en/product/loch-lomond-inchmoan-10-year-old-1000ml-46--mp00139518.model.json, INCHMOAN 10 YEAR OLD 1000ML 46%,88.0,0.0,Loch Lomond,Inchmoan 10 year old single malt is born from a combination of malt whiskies from our traditional swan. Neck pot still and our unique straight neck pot still to create an unconventional peat character with a lot of depth marrying smoke and spiceness.<br /><br />It is matured for a minimum of 10 year in a mix of recharred American oak and refill bourbon American oak casks giving sweet vanilla background notes that complements the soft peat style of Loch Lomond’s unique still set up.,,LOCH-LOMOND-INCHMOAN-10-YEAR-OLD-1000ML-46-
"https://www.ishopchangi.com/en/product/glenlivet-15-yrs-700ml--alc--40--mp00123178.html?p_collection=HOMEDELIVERYNONTRAVELLER,LANDSIDE#referer=categorylisting",https://www.ishopchangi.com/en/product/glenlivet-15-yrs-700ml--alc--40--mp00123178.model.json,"Glenlivet 15 yrs 700ml, Alc. 40%",123.0,130.0,THE GLENLIVET,"The 15 Year Old is deep gold in colour, and leaves behind traces of sweet almond and spice. The 15 Year Old gets its distinctive rich and exotic character from a process of selective maturation in which a proportion of the spirit is matured in French oak casks.",,Glenlivet-15-yrs-700ml--Alc--40-
"https://www.ishopchangi.com/en/product/the-macallan-rare-cask-mp00117511.html?p_collection=HOMEDELIVERYNONTRAVELLER,LANDSIDE#referer=categorylisting",https://www.ishopchangi.com/en/product/the-macallan-rare-cask-mp00117511.model.json,The  Rare Cask,420.9,441.0,MACALLAN,"<b>Images shown are for illustration purposes only, vintage may vary.</b><br /><br />The Macallan Rare Cask (43% abv) is the most diverse and intricate Macallan whisky; a reinterpretation of the classic profile achieved through the widest palette of cask styles. Crafted from 16 different cask styles, predominantly first fill, American and Spanish oak of various cask size – butts, hogsheads and puncheons, made by multiple cask manufacturers and seasoned by multiple sherry bodegas to our exact specifications. Some casks used in the creation of Rare Cask will never be used again as they are from cooperages and bodegas that no longer exist. Far less than 1% of the casks maturing at the distillery have been identified as fitting to bestow the Rare Cask name. The result is unadulterated product complexity.<br /><br />Colour : Mahogany red<br />Aroma : Soft notes of opulent vanilla and raisin pique the nose, giving way to a sweet ensemble of apple, lemon and orange. All balanced by a spicy quartet of root ginger, cinnamon, nutmeg and clove.<br />Palate : This spicy quartet is unwavering Oak resonates, timeless, polished and rich. Vanilla and chocolate lead the finale along with a light citrus zest.<br />Finish : Full and warming.",,The-Macallan-Rare-Cask
"https://www.ishopchangi.com/en/product/ttl-omar-whisky--bourbon---1000ml----free-2-whisky-glasses-mp00130501.html?p_collection=HOMEDELIVERYNONTRAVELLER,LANDSIDE#referer=categorylisting",https://www.ishopchangi.com/en/product/ttl-omar-whisky--bourbon---1000ml----free-2-whisky-glasses-mp00130501.model.json,"TTL  (Bourbon), 1000ML +  FREE 2 Whisky Glasses",135.0,146.0,OMAR WHISKY,"Our whisky matured in American bourbon casks for more than 4 years. Selected by many qualified panelists then bottled in cask strength by hand. It is not only the representative whisky of Nantou Distillery, but also the model of ex-bourbon cask whisky in Taiwan. Without coloring and chill-filtration. <br />Color: Deep Golden<br />Aroma: Yellow flowers, honey, butter, citrus and dried longan with scent of joss stick, angelica sinensis making the ancient oriental sense of mystery. <br />Palate: Complex texture with sweetness and bitterness, then back to sweetness<br />Finish: Long finish with butter and citrus.<br /><br />Alcohol: 46%",,TTL-Omar-Whisky--Bourbon---1000ML----FREE-2-Whisky-Glasses
"https://www.ishopchangi.com/en/product/benriach-25-years-mp00111754.html?p_collection=HOMEDELIVERYNONTRAVELLER,LANDSIDE#referer=categorylisting",https://www.ishopchangi.com/en/product/benriach-25-years-mp00111754.model.json, 25 Years,448.0,480.0,BENRIACH,"Our Master Blender works with different casks for this 25-year-old expression to ensure a consistent taste profile batch after batch. The latest batch is a balanced maturation of bourbon and red wine casks and offers a rare opportunity to taste an older expression that has used red wine casks for such a long period of maturation. Later in F19 this expression will move to a five cask matured whisky recipe and be a more natural older brother to the four-cask matured twenty-one year old.<br /><br />Nose : Rich honey, spices, apples work in combination with superb oak-wood notes.<br />Palate : A rich cocktail of honey, sherry cocoa and apples, supported by a fascinating<br />presence of citrus and wonderful wood tones.",,BenRiach-25-Years
"https://www.ishopchangi.com/en/product/cragganmore-distillers-edition-whisky-mp00114911.html?p_collection=HOMEDELIVERYNONTRAVELLER,LANDSIDE#referer=categorylisting",https://www.ishopchangi.com/en/product/cragganmore-distillers-edition-whisky-mp00114911.model.json, Distillers Edition Whisky,98.0,106.0,CRAGGANMORE,"<b>Images shown are for illustration purposes only, vintage may vary.</b><br /><br />The complexity of Cragganmore makes it an out-of-the-ordinary choice for a second cask finish. However, port-wine casks provide the perfectly harmonious partner. Sweet, intense fruit fragrances and a deep oak-smoked malty taste, then a long dry finish.",,Cragganmore-Distillers-Edition-Whisky
"https://www.ishopchangi.com/en/product/bowmore-18-years-old-gift-pack-mp00115880.html?p_collection=HOMEDELIVERYNONTRAVELLER,LANDSIDE#referer=categorylisting",https://www.ishopchangi.com/en/product/bowmore-18-years-old-gift-pack-mp00115880.model.json, 18 Years Old Gift Pack,129.0,209.0,BOWMORE,"Consist of:<br />1x Bowmore 18 Year Old Single Malt Scotch Whisky 700ml<br />2x Bowmore Glass<br /><br />Ultimate Spirits Challenge: 96 points <br /><br />Finalist / Extraordinary - Ultimate Recommendation<br /><br />Whisky Advocate Rating: 91 points (John Hansell)<br /><br />A Masterful Combination – Cosseted away in the finest, hand-selected oak casks and allowed to mature at its own sedate pace, this is one of the most remarkable, perfectly balanced malts of its kind.<br /><br />Colour: Mellow mahogany<br />Nose: Classic Bowmore smokiness, perfectly tempered with creamy caramel, chocolate and ripe fruit aromas<br />Palate: Beautiful soft fruit and chocolate balanced with a light smokiness - incredibly complex<br />Finish: Long and wonderfully balanced finish",,Bowmore-18-Years-Old-Gift-Pack
"https://www.ishopchangi.com/en/product/auchentoshan-three-wood-gift-pack-mp00115875.html?p_collection=HOMEDELIVERYNONTRAVELLER,LANDSIDE#referer=categorylisting",https://www.ishopchangi.com/en/product/auchentoshan-three-wood-gift-pack-mp00115875.model.json, Three Wood Gift Pack,85.9,140.0,AUCHENTOSHAN,"Consist of:<br /><br />1x Auchentoshan Three Wood Single Malt Scotch Whisky 700ml<br />2x Auchentoshan Glass<br /><br />This unique Auchentoshan Lowland Single Malt Whisky has been matured in three different cask types. Moving from American Bourbon to Spanish Oloroso Sherry - and finally Pedro Ximenez Sherry casks - Three Wood is a rich, complex whisky with incredible toffee and sherry oak flavours.<br /><br />Colour: Rich golden bronze<br />Nose: Blackcurrant, brown sugar, orange, plum and raisin<br />Palate: Fruit and syrup. Hazelnut with hints of cinnamon and lemon. A butterscotch sweetness adds to the overall complexity<br />Finish: Fresh and fruity, with long lasting oaky sweetness",,Auchentoshan-Three-Wood-Gift-Pack
"https://www.ishopchangi.com/en/product/laphroaig-30-years-old-ian-hunter-limited-edition-mp00115862.html?p_collection=HOMEDELIVERYNONTRAVELLER,LANDSIDE#referer=categorylisting",https://www.ishopchangi.com/en/product/laphroaig-30-years-old-ian-hunter-limited-edition-mp00115862.model.json, 30 Years Old Ian Hunter Limited Edition,1762.9,1800.0,LAPHROAIG,"Nose<br />Sweet and medicinal with manuka honey, light peat smoke, cooked apple and rosemary vanilla. Orgeat syrup and a hint of lemon peel complete the aroma.<br /><br />Palate<br />Peaty and peppery with notes of herbs, cedar, kumquat zest and gorse flower. A sweetness of custard cream and vanilla pods.<br /><br />Finish<br />Coastal with subtle iodine, sea salt and seaweed notes. A touch of coffee and oaky character.<br /><br />Colour<br />Burnished gold.<br /><br />Maturation<br />30 Years in first-fill American white oak bourbon barrels.<br /><br />Serve suggestion<br />Neat, with ice or a drop of water.",,Laphroaig-30-Years-Old-Ian-Hunter-Limited-Edition
"https://www.ishopchangi.com/en/product/kavalan-solist-moscatel-sherry-single-cask-strength-single-malt-whisky-57-1---750ml-mp00123644.html?p_collection=HOMEDELIVERYNONTRAVELLER,LANDSIDE#referer=categorylisting",https://www.ishopchangi.com/en/product/kavalan-solist-moscatel-sherry-single-cask-strength-single-malt-whisky-57-1---750ml-mp00123644.model.json, SOLIST MOSCATEL SHERRY SINGLE CASK STRENGTH SINGLE MALT WHISKY 57.1%  750ML,306.0,0.0,KAVALAN,"Moscatel is a special variety of sherry wine. The combination of Moscatel casks, Kavalan new make and our subtropical heat is simply magical in terms of maturation quality. This Kavalan single malt is packed with surprises for all of the sensory receptors that once again brings out Kavalan's richness and complexity to its fullest.",,KAVALAN-SOLIST-MOSCATEL-SHERRY-SINGLE-CASK-STRENGTH-SINGLE-MALT-WHISKY-57-1---750ML
"https://www.ishopchangi.com/en/product/kavalan-solist-manzanila-sherry-single-cask-strength-single-malt-whisky-57-8--750ml-mp00123638.html?p_collection=HOMEDELIVERYNONTRAVELLER,LANDSIDE#referer=categorylisting",https://www.ishopchangi.com/en/product/kavalan-solist-manzanila-sherry-single-cask-strength-single-malt-whisky-57-8--750ml-mp00123638.model.json, SOLIST MANZANILA SHERRY SINGLE CASK STRENGTH SINGLE MALT WHISKY 57.8% 750ML,306.0,0.0,KAVALAN,"Manzanilla is much like Fino sherry, which is produced by the sea where the conditions are even more suitable for the growing of flor. Though the maturation is the same as for the Kavalan Fino, the texture is lighter and more delicate with a touch of saltiness together with mineral flavours, which are all the consequences of a stable and thick layer of flor, sea breezes and brine.",,KAVALAN-SOLIST-MANZANILA-SHERRY-SINGLE-CASK-STRENGTH-SINGLE-MALT-WHISKY-57-8--750ML
"https://www.ishopchangi.com/en/product/kavalan-podium-single-malt-whisky-1000ml-46--mp00120292.html?p_collection=HOMEDELIVERYNONTRAVELLER,LANDSIDE#referer=categorylisting",https://www.ishopchangi.com/en/product/kavalan-podium-single-malt-whisky-1000ml-46--mp00120292.model.json, PODIUM SINGLE MALT WHISKY 1000ML 46%,133.5,0.0,KAVALAN,"<b>Images shown are for illustration purposes only, vintage may vary.</b><br /><br />Created from hand-selected brand new American oak casks and re-fill casks, this expression is surprisingly delicate and extremely complex. It is a resounding endorsement of our sophisticated wood policy.",,KAVALAN-PODIUM-SINGLE-MALT-WHISKY-1000ML-46-
"https://www.ishopchangi.com/en/product/kavalan-concertmaster-single-malt-whisky-1000ml-40--sherry-cask-finish-mp00120282.html?p_collection=HOMEDELIVERYNONTRAVELLER,LANDSIDE#referer=categorylisting",https://www.ishopchangi.com/en/product/kavalan-concertmaster-single-malt-whisky-1000ml-40--sherry-cask-finish-mp00120282.model.json, CONCERTMASTER SINGLE MALT WHISKY 1000ML 40% SHERRY CASK FINISH,76.4,0.0,KAVALAN,"The second whisky in the Kavalan Concertmaster series is aged in the distillery's own special reserve of refill casks, then finished in the finest hand-picked Spanish Sherry casks. Wonderfully elegant, soft and fruity with delicate aromas and a complexity of layers, it showcases the art of Kavalan’s blending and the depth of flavours made possible in this unique subtropical climate.",,KAVALAN-CONCERTMASTER-SINGLE-MALT-WHISKY-1000ML-40--SHERRY-CASK-FINISH
"https://www.ishopchangi.com/en/product/glenallachie-10-year-cs-batch-3-58-2--700ml-mp00118204.html?p_collection=HOMEDELIVERYNONTRAVELLER,LANDSIDE#referer=categorylisting",https://www.ishopchangi.com/en/product/glenallachie-10-year-cs-batch-3-58-2--700ml-mp00118204.model.json, 10 YEAR CS BATCH 3 58.2% 700ML,199.0,212.93,GLENALLACHIE,"GLENALLACHIE 10 YEARS CASK STRENGTH, Billy Walker spends endless amounts of time in the GlenAllachie warehouses sampling across our range of casks, with over 50,000 on-site it’s not a job for the faint-hearted. However, it’s certainly time well spent when the results of his endeavours are tasted. After sampling this vast range of casks Billy was keen to showcase GlenAllachie bottled at natural strength.",,GLENALLACHIE-10-YEAR-CS-BATCH-3-58-2--700ML
"https://www.ishopchangi.com/en/product/glenallachie-12-year-px-sherry-finish--48--700ml-mp00118150.html?p_collection=HOMEDELIVERYNONTRAVELLER,LANDSIDE#referer=categorylisting",https://www.ishopchangi.com/en/product/glenallachie-12-year-px-sherry-finish--48--700ml-mp00118150.model.json, 12 YEAR PX SHERRY FINISH  48% 700ML,179.0,191.53,GLENALLACHIE,"GLENALLACHIE 12 YEARS PEDRO XIMENEZ SHERRY, this glorious rich mahogany malt has been matured for over ten years in American Oak Wood Barrels. The additional maturation in richly seasoned Pedro Ximenez Puncheons enriches the flavour, creating a sweeter, fruitier whisky. The casks are regularly monitored to ensure the perfect balance between our single malt and this luscious dessert sherry.",,GLENALLACHIE-12-YEAR-PX-SHERRY-FINISH--48--700ML
"https://www.ishopchangi.com/en/product/glenallachie-18-year-46--700ml-mp00118134.html?p_collection=HOMEDELIVERYNONTRAVELLER,LANDSIDE#referer=categorylisting",https://www.ishopchangi.com/en/product/glenallachie-18-year-46--700ml-mp00118134.model.json, 18 YEAR 46% 700ML,290.0,313.51,GLENALLACHIE,"GLENALLACHIE 18 YEARS, working across our 16 warehouses with casks dating back to the 1970s, the signature GlenAllachie rich, the robust spirit in harmony with the heather and butterscotch notes that Billy has selected a limited number of casks to be released. When we received the keys to GlenAllachie our Master Distiller Billy Walker immediately set to work putting his fingerprint on our whisky; Scottish barley, 160-hour fermentation, slow distillation. As a blender for almost 50 years, the warehouses are where Billy does comes into his own.",,GLENALLACHIE-18-YEAR-46--700ML
"https://www.ishopchangi.com/en/product/deanston-1991-muscat-700ml-limited-edition-45--mp00131037.html?p_collection=HOMEDELIVERYNONTRAVELLER,LANDSIDE#referer=categorylisting",https://www.ishopchangi.com/en/product/deanston-1991-muscat-700ml-limited-edition-45--mp00131037.model.json, 1991 MUSCAT 700ML LIMITED EDITION 45%,460.0,0.0,DEANSTON,"Distilled & filled into whisky re-fill casks on 7th of October 1991, then transferred to Muscat casks 17th June 2016. We only produced 1402 bottles of this fruity full bodied 28 year old whisky",,DEANSTON-1991-MUSCAT-700ML-LIMITED-EDITION-45-
"https://www.ishopchangi.com/en/product/old-pulteney-huddart---free-2-rock-glasses-mp00133550.html?p_collection=HOMEDELIVERYNONTRAVELLER,LANDSIDE#referer=categorylisting",https://www.ishopchangi.com/en/product/old-pulteney-huddart---free-2-rock-glasses-mp00133550.model.json, HUDDART + Free 2 Rock Glasses,170.0,209.72,OLD PULTENEY,"OLD PULTENEY HUDDART, a distinctively smoky take on Old Pulteney celebrating our birthplace. Richly warming, this single malt embraces a mellow smoky character, whilst very much Old Pulteney at its heart. The combination of influence from the salt-infused sea air and the peat smoke make for a whisky with real character, depth and identity. With a richness extending into its rich gold colour, this single malt offers much in terms of complexity and flavour while subtly reminding us of the place where Old Pulteney began.<br /><br />Aroma: Rich and warming. Brimming initially with mellow wood smoke, honey and oily leather, blooming later into crisp green apple. Creamy vanilla and a hint of burnt toffee in the background.<br />Taste: Freshly-ground spices and soft vanilla balance the notes of smoke and peat fire. There are both richly sweet and distinctly salty coastal flavours in the background, together reminiscent of salted caramel.<br />Colour: Rich gold.<br /><br />Alcohol: 46%<br />Volume: 700ML",,OLD-PULTENEY-HUDDART---Free-2-Rock-Glasses
"https://www.ishopchangi.com/en/product/the-dalmore-portwood-mp00139506.html?p_collection=HOMEDELIVERYNONTRAVELLER,LANDSIDE#referer=categorylisting",https://www.ishopchangi.com/en/product/the-dalmore-portwood-mp00139506.model.json, Portwood,168.0,0.0,THE DALMORE,The spirit is initially matured in the finest American white oak ex-bourbon casks. This gives its first base of soft vanilla and honey notes The precious whisky is then apportioned between the American white oak casks and aged Tawny Port pipes from W & J Graham’s vineyard in Portugal. The two parts are then brought back together to harmonise.<br /><br />Alcohol: 46.5%,,The-Dalmore-Portwood
"https://www.ishopchangi.com/en/product/benriach-quarter-cask-peated-single-malt-scotch-whiskey-46--700ml-mp00088652.html?p_collection=HOMEDELIVERYNONTRAVELLER,LANDSIDE#referer=categorylisting",https://www.ishopchangi.com/en/product/benriach-quarter-cask-peated-single-malt-scotch-whiskey-46--700ml-mp00088652.model.json, QUARTER CASK PEATED SINGLE MALT SCOTCH WHISKEY 46% 700ML,65.6,82.0,BENRIACH,"<b>Images shown are for illustration purposes only, vintage may vary.</b><br /><br />The malted barley used to make this expression has been smoked using Highland peat, enriching the whisky with regional notes of wood and campfire smoke.  The intense maturation of this elegant peated whisky in quarter casks balances the earthy, barbeque and campfire smoke notes of the spirit with the spice of the wood.",,BENRIACH-QUARTER-CASK-PEATED-SINGLE-MALT-SCOTCH-WHISKEY-46--700ML
"https://www.ishopchangi.com/en/product/starward-nova-single-malt-700ml-41--mp00062685.html?p_collection=HOMEDELIVERYNONTRAVELLER,LANDSIDE#referer=categorylisting",https://www.ishopchangi.com/en/product/starward-nova-single-malt-700ml-41--mp00062685.model.json, NOVA SINGLE MALT 700ML 41%,75.6,0.0,STARWARD,"<b>Images shown are for illustration purposes only, vintage may vary.</b><br /><br />Starward Nova is an award winning Single Malt produced in Melbourne and fully matured in Australian red wine casks.",,STARWARD-NOVA-SINGLE-MALT-700ML-41-
"https://www.ishopchangi.com/en/product/-bundle--johnnie-walker-white-walker--2x700ml-mp00137535.html?p_collection=HOMEDELIVERYNONTRAVELLER,LANDSIDE#referer=categorylisting",https://www.ishopchangi.com/en/product/-bundle--johnnie-walker-white-walker--2x700ml-mp00137535.model.json,"[Bundle]  White Walker, 2X700ML",90.0,150.0,JOHNNIE WALKER,"[Bundle]Johnnie Walker White Walker, 41.7%, 2X700ML <br />Send a raven – Scotch has officially entered the realm. Johnnie Walker is proud to present this limited-edition Scotch whisky, inspired by the most enigmatic and feared characters on the hit HBO® show Game of Thrones - the White Walkers.<br /><br />Created by whisky specialist George Harper, alongside the small team of expert blenders at Johnnie Walker, this innovative whisky is best served directly from the freezer, echoing the chilling presence of the White Walkers.<br /><br />The Scotch has notes of caramelised sugar and vanilla, fresh red berries with a touch of orchard fruit and features Single Malts from Cardhu and Clynelish – one of Scotland’s most Northern distilleries. Blender George Harper used the Frozen North as his starting point for creating White Walker by Johnnie Walker. He said: “Whiskies from Clynelish have endured long, Scottish Winters, not dissimilar to the long periods endured by the Night’s Watch who have ventured north of the wall - so it was the perfect place to start when creating this unique whisky.”<br /><br />This limited edition blend brings you right to the Frozen North with an icy white and blue design along with the iconic Johnnie Walker Striding Man now fashioned in armour to fit in among the ranks of the Night King’s forces. Utilising temperature-sensitive ink technology, fans will be reminded that “Winter is Here” from an unexpected graphic icy reveal on the bottle when frozen. (1 throne, 7 kingdom)",,-Bundle--Johnnie-Walker-White-Walker--2X700ML
